Rank,Name,basename,Genre,ESRB_Rating,Platform,Publisher,Developer,VGChartz_Score,Critic_Score,User_Score,Total_Shipped,Global_Sales,NA_Sales,PAL_Sales,JP_Sales,Other_Sales,Year,Last_Update,url,status,Vgchartzscore,img_url,Global_Total,Summary
9225,Star Wars: The Clone Wars & Tetris Worlds,star-wars-the-clone-wars-amp-tetris-worlds,Misc,T,XB,Microsoft,Various,,,,0.0,0.19,0.14,0.04,,0.01,2003.0,25th Sep 18,http://www.vgchartz.com/game/24339/star-wars-the-clone-wars-amp-tetris-worlds/?region=All,1,,/games/boxart/6333921ccc.jpg,0.19, 
9226,The Bee Game,the-bee-game,Adventure,E,DS,Midway Games,Midway,,,,0.0,0.19,0.17,,,0.01,2007.0,,http://www.vgchartz.com/game/12295/the-bee-game/?region=All,1,,/games/boxart/full_8154054AmericaFrontccc.jpg,0.19,"A strong storm has blown through corn poppy meadow and some of the residents of the hive are now missing! Help Maya and Willie by taking on challenges and completing mini-games to find clues in the meadow, dark forest, blue pond, deep caverns and the garden to locate the other bees.  "
9227,CSI: Fatal Conspiracy,csi-fatal-conspiracy,Adventure,M,PS3,Ubisoft,Telltale Games,,,,0.0,0.19,0.11,0.05,,0.02,2010.0,,http://www.vgchartz.com/game/46731/csi-fatal-conspiracy/?region=All,1,,/games/boxart/full_csi-fatal-conspiracy_4AmericaFront.jpg,0.19,"CSI: Fatal Conspiracy is an all new immersive experience thanks to  intriguing cases written with CSI show writers, a fully updated  rendering engine allowing for more realistic lighting effects, and  enhanced character acting and lip sync with the voices of the main  actors from the show.
Team up with the Cast of CSI: Crime Scene Investigation not only to  solve some of the most gruesome crimes of Sin City, but also to take  down a dangerous drug cartel.
Partner with FBI agent Gene Huntby in 5 Connected Cases to take down the  Queen of the Hive. For the first time ever, the storyline engages you  from the first case to the last.
Be Prepared to Work with your CSI Partners, including the returning Sara  Sidle, to solve murder cases and uncover the Fatal Conspiracy behind  the crimes you investigate.
Ubisoft "
9228,Happy Cooking,happy-cooking,Simulation,E,DS,Ubisoft,MTO,,,,0.0,0.19,0.17,0.0,,0.01,2008.0,,http://www.vgchartz.com/game/28183/happy-cooking/?region=All,1,,/games/boxart/full_happy-cooking_790AmericaFront.jpg,0.19,"
Be the Best Cook Around!
Play through a culinary adventure where you cut, stir, and fry your way        to the top! Test your skills as you master a variety of tasty dishes.        Unlock special modes and mini-games through competitions, quizzes, and        more. Use your stylus as the ultimate kitchen tool and run your kitchen        the way you like it!
 
Nintendo "
9229,EverQuest Online Adventures: Frontiers,everquest-online-adventures-frontiers,Role-Playing,T,PS2,Sony Online Entertainment,Sony Online Entertainment,,,,0.0,0.19,0.09,0.07,,0.02,2003.0,,http://www.vgchartz.com/game/672/everquest-online-adventures-frontiers/?region=All,1,,/games/boxart/1059114ccc.jpg,0.19,"After centuries of solitude, the ogres of Oggok have finally opened their gates to the outside world. The long lost Mountains of Rathe, the volcanic Lavastorm Mountains and Veeshan's realm, The Plane of Sky, are now open to all explorers and adventurers. To the West, the Erudites have begun their massive exodus to the unknown islands of the Western Sea to escape the hypocrisy and corruption of their human neighbors. A true frontier, Odus will prove more than just a challenge to the Erudites, for their very existence is at stake. Adventure into Veeshan's home, the altered Plane of Sky. Find your way through massive hanging islands among the clouds. Untold treasures and power await any adventurer daring enough to tackle this perilous landscape. The gnomes of Klick`Anon have finally broken through the northeastern mountains and stumbled upon the tumultuous lands of Lavastorm. Reputed to be ruled by a mysterious tyrant of flame and lava, it's up to Norrath's adventurers to discover the new frontiers.
[Sony Online Entertainment] "
9230,F1 2017,f1-2017,Racing,E,XOne,Deep Silver,Codemasters,,,,0.0,0.19,0.04,0.13,,0.01,2017.0,23rd May 18,http://www.vgchartz.com/game/177461/f1-2017/?region=All,1,,/games/boxart/full_2792454AmericaFrontccc.jpg,0.19,"F1™ 2017 is the official videogame of the 2017 FIA FORMULA ONE WORLD  CHAMPIONSHIP™, and includes the return of classic F1 cars to the series,  as well as an even deeper career mode, numerous multiplayer  enhancements, and a brand new ‘Championships’ game mode.
Win the 2017 World Championship, break every record in the fastest  ever F1™ cars, and race some of the most iconic F1 cars of the last 30  years. With an even deeper ten year Career, more varied gameplay in the  new ‘Championships’ mode, and a host of other new features, both online  and offline, F1 2017 remains  the most complete and thrilling F1  videogame to date.
Scoring the maximum five stars from the Telegraph, reviewer Sam White  commented: ‘the/a mix of refined mechanics, updated graphics and all  new cars results in a game that’s up there with the studio’s old-time  greats.’
Source: codemasters.com "
9231,Imagine: Babyz Fashion,imagine-babyz-fashion,Simulation,E,DS,Ubisoft,Visual Impact,,,,0.0,0.19,0.17,,,0.01,2009.0,,http://www.vgchartz.com/game/39953/imagine-babyz-fashion/?region=All,1,,/games/boxart/full_2639556AmericaFrontccc.jpg,0.19,"You’ve played with them and cared for them, now it’s time to turn them into stars! Prepare for fashion contests, photo shoots and runway lights. Choose the most perfect outfits according to the contest themes and coordinate accessories to match!
 
Ubisoft "
9232,Go Play: Lumberjacks,go-play-lumberjacks,Simulation,E,Wii,Majesco,Panic Button,,,,0.0,0.19,0.17,,,0.01,2009.0,,http://www.vgchartz.com/game/32548/go-play-lumberjacks/?region=All,1,,/games/boxart/full_6452430AmericaFrontccc.jpg,0.19,"Go Play Lumberjacks pits a cast of wacky lumberjacks in four-player        competition as they climb, chop, saw and logroll their way to victory!        Use your Wii Remote as the all-in-one timber-cutting contest tool. Saw        dust will fly from your chainsaw in the Hot Saw; test your balance on        the waterlogged Log Roll, ascend towering tree trunks in the Pole Climb        and much more!

Four-player party competition from the great outdoors!
Five event categories with featuring over 15 individual events:

Sawing: Solo Cross, Hot Saw & more
Axe Throwing: First to        1000, Time Limit & more
Climbing: Pole Climb, Tree Top
Chopping: Underhand, Springboard & more
Water        Events: Log Roll, Boom Run


15 eclectic characters to chose from,        each with unique animations and tools:

Jack, the err, giant        lumberjack
Jill, the chainsaw-toting beauty
Nozawa, the ninja assassin
Bart, the peg legged pirate
Lance, the lumbering medieval knight
Axl, the 80’s        rocker


Unlock use of your own Mii!
Wii Balance Board        support
Earn trophies unlockable pieces of gear (saws, axes, and        more)
Up to four live players can play at a time (AI will fill in        remaining spots in one, two or three individual player matches) 
 "
9233,Phantasy Star Online Ver. 2,phantasy-star-online-ver-2,Role-Playing,T,DC,Sega,Sonic Team,,8.3,,0.0,0.19,,,0.19,0.0,2001.0,,http://www.vgchartz.com/game/4004/phantasy-star-online-ver-2/?region=All,1,,/games/boxart/9759589ccc.jpg,0.19,Phantasy Star Online V. 2 is a bugfix or an upgrade to the Original Phantasy Star Online on the Sega Dreamcast. The game was released in 2001 and later ported to the Windows Platform  
9234,Treasures of the Deep,treasures-of-the-deep,Action,T,PS,Namco,Black Ops Entertainment,,,,0.0,0.19,0.1,0.07,,0.01,1997.0,,http://www.vgchartz.com/game/32055/treasures-of-the-deep/?region=All,1,,/games/boxart/full_1873273AmericaFrontccc.jpg,0.19, 
9235,Ninja Gaiden 3: Razor's Edge,ninja-gaiden-3-razors-edge,Action,M,WiiU,Nintendo,Team Ninja,,6.5,,0.0,0.19,0.14,0.03,,0.02,2012.0,07th Jan 18,http://www.vgchartz.com/game/70797/ninja-gaiden-3-razors-edge/?region=All,1,,/games/boxart/full_9197737AmericaFrontccc.jpg,0.19,"Ryu Hayabusa + Ayane + Wii U = Ninja Awesomeness
The solitary ninja, Ryu Hayabusa, must find a way to lift the deadly curse on his right arm before it destroys him. NINJA GAIDEN 3: Razor’s Edge has been reworked to bring to Wii U the truly intense, high-speed challenge and action NINJA GAIDEN fans demand. And this time, the female ninja, Ayane, will join the battle as a new playable character in her own exclusive chapters within story mode. With more weapons and Ninpo types, a new character progression system, a redesigned battle system, a new character, two-player online co-op game play using Ryu and Ayane, and the return of dismemberment, NINJA GAIDEN 3: Razor’s Edge improves upon the original NINJA GAIDEN 3 in every way and offers Wii U exclusive features and functionalities.

New Playable Character: Ayane – NINJA GAIDEN 3: Razor’s Edge adds a new playable character: the female ninja, Ayane, who will be available in her own exclusive new chapters within the story mode.
Chapter Challenge Mode – In this separate mode, players can progress through any of the chapters in the story mode using either Ryu Hayabusa or Ayane.
Online Co-op Multiplayer mode with Ryu and Ayane – In addition to an up to eight-player multiplayer battle mode, the game now offers Ryu and Ayane as playable characters in the two-player online co-op multiplayer mode.
Unique Wii U controls – During single-player mode, players can enjoy faster and more fluid action by using the touch screen of the Wii U GamePad controller to select weapons,execute Ninpo or see the combo chart.
New Weapons and Ninpo Types – Exclusive to the Wii U version, the game includes six weapon types and three Ninpo types for Ryu Hayabusa, allowing for greater game-play variation and deeper strategy. Ayane also comes with her own set of weapons and Ninpo types.
Character/Weapon Progression System – Using the Karma points earned during game play, players can now upgrade their weapons and Ninpo, earn new moves and increase the character HP level.
Faster, More Intense Battles – Improved enemy AI, the return of dismemberment, as well as new enemy types and battle areas have been added for greater variety in battles and increased replay value.

Source: Nintendo "
9236,Samurai Warriors: State of War,samurai-warriors-state-of-war,Action,T,PSP,KOEI,Omega Force,,6.5,,0.0,0.19,0.07,0.0,0.11,0.01,2006.0,,http://www.vgchartz.com/game/1965/samurai-warriors-state-of-war/?region=All,1,,/games/boxart/7828907ccc.jpg,0.19,"Samurai Warriors: State of War is set in civil war Japan, when great commanders such as Nobunaga Oda, Shingen Takeda, and Kenshin Uesugi struggled for control of the country. Arm yourself with classic Japanese weaponry such as katanas and shuriken, and launch into the chaos of 16th century Japan. The action is relentless, and ranges from massive open-field warfare to sieges of trap-laden castles.
www.us.playstation.com "
9237,Dragon Blade: Wrath of Fire,dragon-blade-wrath-of-fire,Action,T,Wii,D3 Publisher,D3 Publisher,,,,0.0,0.18,0.17,0.0,,0.01,2007.0,,http://www.vgchartz.com/game/7524/dragon-blade-wrath-of-fire/?region=All,1,,/games/boxart/6284669ccc.jpg,0.18,"
The power of the Dragon is in your hands!
3rd person action-adventure game set in a fantasy world where an evil        dragon has been trapped inside six pieces of an enchanted sword. Play as        a young man who first finds the sword and learns to unleash the powers        of the dragon through his sword and arms. An all-new arcade-oriented        experience that takes advantage of the Wii Remote with incredibly        responsive swordplay.
 

 Uniquely designed, two-handed Wii control scheme - Use both arms          simultaneously to emulate a dragon's arms, wings, tail, fire and more. 
 20 levels spread across six different, richly detailed fantasy worlds 
 Upgradeable combat systems and graphically stunning weapons based on          the supernatural powers of a dragon 
 Original story by Richard A. Knaak of the DragonLance series 
 String together combos using the Dragon forms to inflict maximum          damage during epic boss battles! 

Nintendo "
9238,Ghostbusters: The Video Game,ghostbusters-the-video-game,Action,E10,PSP,Atari,Red Fly Studio,,,,0.0,0.18,0.16,0.01,,0.02,2009.0,,http://www.vgchartz.com/game/35371/ghostbusters-the-video-game/?region=All,1,,/games/boxart/full_ghostbusters-the-video-game_6AmericaFront.jpg,0.18,"Who ya gonna call? The Ghostbusters are back for an all new adventure in Ghostbusters: The Video Game. With Manhattan overrun again by supernatural creatures, take on the role of a new recruit joining the famous Ghostbusters team. Equipped with a variety of unique equipment and gadgets, hunt, fight, and wrangle a wide range of ghosts in an all-new battle to save New York City from its latest paranormal plague.
Playstation "
9239,Fight Club,fight-club,Fighting,M,PS2,VU Games,Genuine Games,,,,0.0,0.18,0.09,0.07,,0.02,2004.0,,http://www.vgchartz.com/game/5102/fight-club/?region=All,1,,/games/boxart/6568916ccc.jpg,0.18,"Broken bones, blood-stained and ripped clothes, and facial deformations are common in Fight Club. Based on the movie of the same name, Fight Club lets you play as one of the many characters from the movie as they fight until someone goes limp, taps out, or is beaten to a pulp. With three different fighting styles and intuitive controls, the game creates a challenging experience for fighting fans of all levels. "
9240,Remington Super Slam Hunting: North America,remington-super-slam-hunting-north-america,Sports,T,Wii,Mastiff,Mastiff,,,,0.0,0.18,0.17,,,0.01,2010.0,,http://www.vgchartz.com/game/47842/remington-super-slam-hunting-north-america/?region=All,1,,/games/boxart/full_remington-super-slam-hunting-north-america_7AmericaFront.jpg,0.18,"Remington Super Slam Hunting: North America is where arcade action meets real hunting. Whether you are going for Bighorn Sheep in Alberta, Whitetail deer in the US Northeast, Elk in the Rocky Mountains or any of the other tons of animals and locations in the game, the two constants are speed and danger. Black Bear, Mountain Lions, angry Bison and host of other wild animals are all waiting to take you down. 

And if that's not scary enough, you can compete with three other hunters at one machine, or the entire world as you post your scores and achievements online. The game also offers a full-on two player cooperative campaign mode. "
9241,Arcania: Gothic 4,arcania-gothic-4,Role-Playing,T,PC,JoWood Productions,Spellbound Entertainment AG,,5.8,,0.0,0.18,0.09,0.08,,0.02,2010.0,,http://www.vgchartz.com/game/35164/arcania-gothic-4/?region=All,1,,/games/boxart/full_arcania-a-gothic-tale_0AmericaFront.jpg,0.18,"War covers over the Southern Islands like a blood-drenched shroud... and finally, War reaches the idyllic isle of Feshyr in the Southern Seas. The protagonist of ArcaniA - A Gothic Tale returns from an adventure to find his home town pillaged and looted. The aggressors’ ships - with an Eagle displayed on their billowing sails - escape over the horizon.Seeking revenge, the hero leaves the destroyed city behind and soon realizes that this cowardly attack did not just happen on a reckless mercenary`s whim. An evil power lies waiting at the threshold of this world, and our hero will need to face this nameless evil. Yet the hero is not alone - his fate is linked to that of a beautiful, mysterious lady as well as a powerful artifact from the long-forgotten distant past, which plays a major role in the grandiose new RPG adventure.
-Official ArcaniA website "
9242,The Munchables,the-munchables,Action,E,Wii,Namco Bandai,Namco Bandai Games,,8.0,,0.0,0.18,0.17,0.0,0.0,0.01,2009.0,,http://www.vgchartz.com/game/32533/the-munchables/?region=All,1,,/games/boxart/full_8789376AmericaFrontccc.jpg,0.18,"• Addictive Gameplay - Once you start eating, you won’t want to stop. Your character grows bigger and bigger the more you eat and so do your enemies.  • Quirky Characters - Eat crazy characters like Eggplanter, Space Shroom, and Rice Baller. Over 150 different enemies will try to stop you from saving the planet. 8 Enemy Bosses.   • 2 Modes of Play - You can play in regular mode and in time-attack mode  • Accessorize your character - Over a dozen different customizations can be made for your main character   • 2 Player Action - Join a friend to help you defeat Don Onion and the Space Pirates.   • Extras - 27 different songs included, played by the Munchables band. And 5 different movies that show you the world of the Munchables.
Namco "
9243,Active Health with Carol Vorderman,active-health-with-carol-vorderman,Sports,,DS,Nintendo,Fuse Games Limited,,,,0.0,0.18,,0.18,,0.01,2009.0,,http://www.vgchartz.com/game/36953/active-health-with-carol-vorderman/?region=All,1,,/games/boxart/full_4655071PALFrontccc.jpg,0.18,"Active Health with Carol Vorderman is a simple and motivating way to get you on track to a healthier lifestyle. It's easy to use, fits around your life and can help to bring the fun back into healthy living. Active Health with Carol Vorderman helps you work towards a balanced lifestyle by focusing on your exercise regime, diet and fitness goals. "
9244,Dance Dance Revolution: Disney Grooves,dance-dance-revolution-disney-grooves,Simulation,E,Wii,Konami,Bemani,,,,0.0,0.18,0.17,,,0.01,2009.0,,http://www.vgchartz.com/game/28180/dance-dance-revolution-disney-grooves/?region=All,1,,/games/boxart/full_7459915AmericaFrontccc.jpg,0.18,"DanceDanceRevolution: Disney Grooves features some of the most popular Disney characters of all-time including Mickey, Minnie, Goofy, Donald and Daisy along with enhanced graphics and 40 favorite Disney tunes. Players will have to complete dance challenges in order to unlock more and more music. For a more personalized experience DanceDanceRevolution: Disney Grooves will allow players to customize their very own Mii's with special Disney costumes in its Dressing Room mode.Additional exclusive modes that will extend the game beyond the standard DanceDanceRevolution format include a Groove World where players achieve goals to unlock cool new costumes stages and songs. Workout Mode, Training Mode and Advanced Mode will challenge the physical limits of experienced players. The game will also feature a My Studio mode that enables players to take pictures of their customized characters, or strike a pose with classic Disney characters. "
9245,Valhalla Knights 3,valhalla-knights-3,Misc,,PSV,Xseed Games,Unknown,,,,0.0,0.18,0.04,0.01,0.12,0.02,2013.0,,http://www.vgchartz.com/game/72306/valhalla-knights-3/?region=All,1,,/games/boxart/full_853293AmericaFrontccc.jpg,0.18, 
9246,Cars: Race-O-Rama,cars-race-o-rama,Racing,E,PS3,THQ,Rainbow Studios,,,,0.0,0.18,0.14,0.03,,0.02,2009.0,,http://www.vgchartz.com/game/35204/cars-race-o-rama/?region=All,1,,/games/boxart/full_8584887AmericaFrontccc.jpg,0.18,"In Cars Race-O-Rama, players will join Lightning McQueen and Chick Hicks in Radiator Springs as they prepare their academy of student racers to compete in the Race-O-Rama Exhibition.  Players will encounter 12 new playable characters making their video game debut.  A new and improved Lightning McQueen will come fully equipped with special racing kits, allowing him to better maneuver brand new, action-packed tracks that will take players to metro city streets, the Baja desert and sandy beaches.  In addition, players are now able to modify Lightning McQueen's wheels, rims, hood, side skirt, rear bumper, spoiler and paint with special customization features, giving Lightning a personalized style and look that has never been seen before.  As players compete in this high-speed, racing adventure game, they will be able to utilize Lightning McQueen's newly designed drifting abilities and perform ""Kachow"" poses for enthusiastic reporters and fans encountered throughout the game.

Cars Race-O-Rama will also feature multiplayer mini-games based on Disney/Pixar's ""Cars Toons,"" a series of animated shorts from the Disney Channel. "
9247,The Incredible Adventures of Van Helsing: Final Cut,the-incredible-adventures-of-van-helsing-final-cut,Role-Playing,,PC,Unknown,NeoCoreGames,,,,0.18,0.0,,,,,2009.0,02nd Mar 19,http://www.vgchartz.com/game/223767/the-incredible-adventures-of-van-helsing-final-cut/?region=All,1,,/games/boxart/full_8516772AmericaFrontccc.jpg,0.18, 
9248,Harvest Moon: A Wonderful Life Special Edition,harvest-moon-a-wonderful-life-special-edition,Simulation,E,PS2,Natsume,Marvelous Interactive,,,,0.0,0.18,0.09,0.07,,0.02,2005.0,,http://www.vgchartz.com/game/959/harvest-moon-a-wonderful-life-special-edition/?region=All,1,,/games/boxart/full_9636925AmericaFrontccc.jpg,0.18,"Wholesome farming lasts a lifetime in the coastal village of Forget-Me-Not Valley. It's a peaceful place where you cultivate friendships and raise a family among your crops and prize-winning livestock. The living isn't always easy, but it's certainly rewarding if you're willing to work hard and make thoughtful choices for your wife, child and profitable pastoral acreage.There are many choices and rich details in this special edition and no chosen path is exactly the same. Will you grow traditional vegetables or develop groundbreaking hybrids? Will you raise a boy or a girl? Can you choose the right neighbors to develop your son's or daughter's interests into a happy and successful career? Your decisions plant the seeds of your destiny and shape your offspring's future. You create the happy ending in this game!
 
Natsume "
9249,Sports Illustrated for Kids: Football,sports-illustrated-for-kids-football,Sports,E,GBA,BAM! Entertainment,Sennari Interactive,,,,0.0,0.18,0.13,0.05,,0.0,2003.0,,http://www.vgchartz.com/game/28413/sports-illustrated-for-kids-football/?region=All,1,,/games/boxart/full_2646552AmericaFrontccc.jpg,0.18, 
9250,Senran Kagura: Estival Versus,senran-kagura-estival-versus,Action,M,PSV,Xseed Games,Marvelous Entertainment,,,,0.0,0.18,0.04,0.03,0.1,0.02,2016.0,29th Jun 18,http://www.vgchartz.com/game/85320/senran-kagura-estival-versus/?region=All,1,,/games/boxart/full_3248558AmericaFrontccc.jpg,0.18, 
9251,.hack//Quarantine Part 4: The Final Chapter,.hack,Role-Playing,T,PS2,Bandai,CyberConnect2,,6.8,,0.0,0.18,0.09,0.07,,0.02,2004.0,,http://www.vgchartz.com/game/5/hackquarantine-part-4-the-final-chapter/?region=All,1,,/games/boxart/4988422ccc.jpg,0.18,"The final episode of the .hack saga, .hack Part 4: Quarantine, is finally here and now the game has you rushing to complete it. This time, you're against the clock as you play as the outlaw player Kite. You must stop CC Corp from moving the game servers offline and killing comatose victims. Upload your saved data from Part 3 and start out with leveled up characters and items to give you a head start. It's your chance to finally unravel the mystery behind ""The World.""
 
Source: us.playstation.com "
