Rank,Name,basename,Genre,ESRB_Rating,Platform,Publisher,Developer,VGChartz_Score,Critic_Score,User_Score,Total_Shipped,Global_Sales,NA_Sales,PAL_Sales,JP_Sales,Other_Sales,Year,Last_Update,url,status,Vgchartzscore,img_url,Global_Total,Summary
14001,Football Manager 2010,football-manager-2010,Sports,E,PC,Sega,Sports Interactive,,8.7,,0.0,0.07,,0.06,,0.01,2009.0,,http://www.vgchartz.com/game/36900/football-manager-2010/?region=All,1,,/games/boxart/full_4284471AmericaFrontccc.jpg,0.07,"Football Manager™ 2010  Features:  •	Polish Making the game faster, more immersible, more realistic and easier to play with better in game feedback and more advice.  •	Improved Match Engine  Improved AI, over 100 new animations in 3d mode, better lighting, improved pitch degradation, stadiums & crowds.  •	Match Analysis  A match analysis tool that shows you where shots, passes, crosses, headers, tackles, fouls and interceptions have happened for both sides, both live in game, and post match, allowing you to work out your, and your opponents, strengths and weaknesses.  •	New GUI  A new look to the game, and a new way of control – gone is the side menu, to be replaced by an easier to use tab system, with everything at your finger tips.  •	Tactics A new tactics module, making it much easier to make your team play as you want them to, with thousands of possible pre-set options, touchline shouts for easily changing things around, and instant changes. (the old system is still there for people who love their sliders).  •	News Center A subscription based newspaper. Get the news about the football world around you that you want, and not the news you don’t want.  •	New Data Editor A brand new data editor. Not only has the functionality and ease of editing data improved, we are also proud to announce that you can now add competitions and extra levels for leagues currently in the game, and add completely new competitions and leagues all via a very simple to use editor.  •	And more…  There are still load of additional features, both big and small, to announce for FM2010, which will be presented via a series of blogs. These are available for non-exclusive syndication for your website or publication.(Publisher) "
14002,NAtURAL DOCtRINE,natural-doctrine,Role-Playing,M,PSV,NIS America,Kadokawa Games,,,,0.0,0.07,0.02,0.01,0.03,0.01,2014.0,23rd Nov 18,http://www.vgchartz.com/game/75658/natural-doctrine/?region=All,1,,/games/boxart/full_6247201AmericaFrontccc.jpg,0.07,"In a chaotic world, a single fortress city is humanity's last beacon.Humans have taken up sword and magic against the encroaching beasts to keep their light from fading.
But some travel into the wilderness, seeking fortune. One such pair is Geoff and Vasily,who act as bodyguards for a young explorer, diving into mines overflowing with dangerous creatures.
These  explorers, known as Bergmans, long ago gained control of mines  throughout the wilderness, claiming the precious ore buried within and  using it to power the last human city and provide a peaceful life for  its more affluent citizens.
But even now, they clash with the  beasts of the wilderness, and must use whatever precious resources they  can scavenge to protect their city.
Geoff, meanwhile, dreams of  proving his worth and earning citizenship of his own. But he would soon  discover that life wasn't as simple as he once thought.
It began  suddenly - selection and survival. Alliances were tested, strained,  broken. The world was changing, evolving, and Geoff would stand as a  central figure in the upheaval.
He would have to confront... the Natural Doctrine.
Source: http://nisamerica.com/games/natural_doctrine/world/world.html "
14003,Major League Baseball 2K10,major-league-baseball-2k10,Sports,E,PSP,2K Sports,Visual Concepts,,,,0.0,0.07,0.06,,,0.01,2010.0,,http://www.vgchartz.com/game/41367/major-league-baseball-2k10/?region=All,1,,/games/boxart/full_3640846AmericaFrontccc.png,0.07,"Major League Baseball 2K10 brings baseball’s most  exciting match-up to  life:  Pitchers vs. Hitters.  Get ready to battle.
Learn the Farm - Play full games with Triple-A teams to  get a closer look at tomorrow’s stars.   Home Run Derby®  -  Play a single round or test your skills in a ladder-style  tournament. To be crowded the champ, you’ll have to outslug baseball’s  most feared power hitters. Many ways to play -  Whether you feel like playing a single season, managing multiple teams  at once, or building a dynasty in Franchise mode, we’ve got you covered.  Put your manager cap on - You’re not playing  the game, you’re controlling it. Make the lineups, pitching changes, substitutions and strategy decisions as you try to outwit your opponent.
 
--2K Sports "
14004,Terraria,terraria,Action,T,PS4,505 Games,Re-Logic,,,,0.0,0.07,,0.05,0.01,0.01,2014.0,19th Mar 18,http://www.vgchartz.com/game/84813/terraria/?region=All,1,,/games/boxart/full_2470874AmericaFrontccc.jpg,0.07,"DIG!  Each Terrarian world is filled to the brim with raw materials waiting to  be gathered, transformed, and utilized! Coupled with a robust crafting  system, the possibilities - and creations - are as limitless as your  imagination.   EXPLORE!  With an assortment of distinct biomes and structures scattered  throughout the landscape, each excursion abounds with the potential for  legendary discoveries. From the serene grasslands to the cruel Dungeon to the ominous  Corruption to the very pit of Hell itself, hours will tick by like  seconds as you delve ever deeper into the wonders and mysteries of your  particular world!
FIGHT!Wield a vast arsenal of weaponry  and armor – from swords to magic spells to firearms and beyond – as you  triumph over the enemy hordes that are intent on your destruction.
Terraria is teeming with life – both friend and foe – that you will  encounter on your expeditions. Nefarious armies, warring factions, and  epic bosses lurk in the shadows as well…seeking to tear you limb from  limb. If that wasn’t enough, it seems as if the very moon has set itself  against you! Fortunately, you are blessed with a vast and diverse arsenal of ways to  defend yourself! From swords to sorcery to firearms to cleverly-designed  traps and beyond: Terraria embraces the notion of combat on your terms,  no matter the playstyle! Take up arms and show the enemy hordes who’s  boss.
BUILD!What good is all that exploration, gathering, and fighting without a place to call home? With an immense toolbox of materials and equipment at your disposal, the only limit to building in Terraria is your creativity. Construct a simple home, an imposing fortress, a complex mechanical  system, or maybe just a statue of yourself – as is true across all of  Terraria, the choice is yours!   Become the architect of your world!Source: Official Site "
14005,Minecraft: Story Mode,minecraft-story-mode,Adventure,E10,WiiU,Mojang,Telltale Games,,,,0.0,0.07,0.04,0.03,,0.01,2016.0,22nd Mar 18,http://www.vgchartz.com/game/85923/minecraft-story-mode/?region=All,1,,/games/boxart/full_3261979AmericaFrontccc.jpeg,0.07,"An 8-Episode Epic Adventure
Minecraft: Story Mode is like a playable television show based on your favorite game, where YOU are the star, and your choices and actions decide how the story is told. Start your adventure now with Episodes 1-5!
Source: telltale.com "
14006,Space Hulk: Vengeance of the Blood Angels,space-hulk-vengeance-of-the-blood-angels,Shooter,T,PS,Electronic Arts,Key Game,,,,0.0,0.07,0.04,0.03,,0.0,1996.0,,http://www.vgchartz.com/game/45096/space-hulk-vengeance-of-the-blood-angels/?region=All,1,,/games/boxart/full_1901221AmericaFrontccc.jpg,0.07,"Cleanse and Burn...  A huge and out-of-control derelict spaceship is racing towards the  imperial planet Delvar III . The honor had befallen the Blood Angels  chapter of imperial space marines to board this gargantuan space hulk,  battle through hordes of Genestealer aliens, divert it from its course  and save the planet from certain destruction.  * back cover *  "
14007,Robot Alchemic Drive,robot-alchemic-drive,Action,T,PS2,Enix,Sandlot,,,,0.0,0.07,0.03,0.03,,0.01,2002.0,,http://www.vgchartz.com/game/1921/robot-alchemic-drive/?region=All,1,,/games/boxart/3805231ccc.jpg,0.07,"Prepare to bond with 75 tons of high-tensile robot. Direct every movement of your machine and slug you way to victory over colossal opponents in brutal hand-to-hand combat (plus missiles, lasers, shooting fists, boomerangs, and much more). Freeway overpass in the way? Take it down. Buildings crowding you? Knock 'em over.
Much more than a simple action game, Robot Alchemic Drive™ accurately simulates the operation of a remote-controlled metal titan in crowded, active urban environments. Use your giant robot as a tool to defeat enemies, complete missions, and much more.
Treat your robot well and you will be rewarded. Abuse your robot and, well, you'll wish you hadn't.
Key Features:

Concurrent gameplay occurs on two levels: The Robot plane and the human plane.
Unique control mechanism simulates remote control of huge robots.
Robots can transform into an alternate form.
Fully usable/destructible environments - if you see it, you can crush it, stomp on it, knock it down. Head up to the top of a skyscraper to view the action.
Intense graphics bring crammed urban cities to life. Classically designed robots move/transform realistically.
Innovative design enables incredible sense of scale.
R&D system enables customization and enhancement of robots.
Story-driven gameplay provides depth lacking in other ""giant robot"" titles.
Character designs by Toshihiro Kawamoto of hit Anime ""Cowboy Bebop"".

- From Square-Enix "
14008,Tokyo Beat Down,tokyo-beat-down,Action,T,DS,Atlus,Success,,,,0.0,0.07,0.06,,,0.01,2009.0,,http://www.vgchartz.com/game/30591/tokyo-beat-down/?region=All,1,,/games/boxart/full_2345155AmericaFrontccc.jpg,0.07,"Who has it within them to rise up against the ever growing threat of violence, crime, and terrorism on the streets of Tokyo? Enter the Beast Cops, tireless servants of justice. These men and women struggle night and day for the heart of the city. They'll match any villain punch for punch, kick for kick, bullet for bullet. They're Beast Cops because they will do whatever it takes, pay any price, inflict as much damage as necessary, in order to restore peace and security to the streets of Tokyo.Features

Beat 'em up that lets you shoot 'em upWhen fisticuffs aren't enough, add guns to deliver a whole new brand of justice to the mean streets of Tokyo. Pick up a variety of weapons, ranging from handguns to rocket launchers, for intense action on each level.
Badass 70's cop show vibeOutrageous style, over-the-top substance, and no holds barred hardboiled police action mix with madcap humor and sharply-written dialogue. Dishing out justice to the seamy underbelly of Tokyo has never been this satisfying.
Multiple characters & endingsThis sordid tale of Tokyo's criminal set unfolds through the eyes of three different cops with unique play styles. Story branches lead to multiple endings that determine whether you'll get your shot to beat down the ultimate crime boss.
 "
14009,Digimon All-Star Rumble,digimon-all-star-rumble,Fighting,,X360,Namco Bandai Games,PROPE,,,,0.0,0.07,0.05,0.01,,0.01,2014.0,,http://www.vgchartz.com/game/83874/digimon-all-star-rumble/?region=All,1,,/games/boxart/full_6788211PALFrontccc.jpg,0.07, 
14010,Motor Toon Grand Prix (Japan),motor-toon-grand-prix-japan,Racing,,PS,Sony Computer Entertainment,Sony Computer Entertainment Japan,,,,0.0,0.07,,,0.06,0.0,1994.0,,http://www.vgchartz.com/game/3849/motor-toon-grand-prix-japan/?region=All,1,,/games/boxart/full_3077401JapanFrontccc.jpg,0.07, 
14011,Dino Master: Dig Discover Duel,dino-master-dig-discover-duel,Strategy,E,DS,Majesco,Creative Office,,2.5,,0.0,0.07,0.06,0.0,,0.0,2006.0,,http://www.vgchartz.com/game/530/dino-master-dig-discover-duel/?region=All,1,,/games/boxart/5893353ccc.jpg,0.07,"
Dino Master drops you into the role of Dave the Digger on his hunt for the biggest and best dinosaur fossils around the globe. Capturing these fossils won't be easy as you move quickly to surround your dig site while trying to avoid giant insects and other nasties. Once you've excavated your finds, bring them back to the Laboratory to rebuild them and then pit dino against dino in Battle Mode.

Includes over 100 real species of dinosaurs 
Dig your way through over 35 different puzzle levels based all over the world
Reanimate your fossils and then battle them against other dinosaurs 
Take on your friend's dinosaurs via 2-player Wireless Link  
Master over 30 fighting techniques for the Battle Mode as you uncover fossils 

Majesco "
14012,Ken to Mahou to Gakuen Mono. 3,ken-to-mahou-to-gakuen-mono-3,Role-Playing,,PS3,Acquire,ZeroDiv,,,,0.0,0.07,,,0.07,,2010.0,,http://www.vgchartz.com/game/45494/ken-to-mahou-to-gakuen-mono-3/?region=All,1,,/games/boxart/full_ken-to-mahou-to-gakuen-mono-3_9JapanFront.jpg,0.07, 
14013,Fable: The Lost Chapters,fable-the-lost-chapters,Role-Playing,M,PC,Microsoft Game Studios,Lionhead Studios,,8.3,,0.0,0.07,0.01,0.05,,0.01,2005.0,,http://www.vgchartz.com/game/15220/fable-the-lost-chapters/?region=All,1,,/games/boxart/full_568303AmericaFrontccc.jpg,0.07,"Imagine a world where every choice and action determines what you become. Where you evolve in real time based on every little thing you do. Your every action determines your character's skills, appearance and morality. Your character's life story is created from childhood through to adulthood and on to old age. Grow from an inexperienced child into the most powerful being in the world, spoken of by all and immortalized in legend.
With experience comes advancement and physical change, whether it be expanding muscles, a keen eye and nimble form, or the buzz of magical energies around your finger tips. As you develop your alter ego, the world reacts to you and your actions. People comment on your successes and failures, your appearance, and your behavior. Their many opinions are expressed through applause, mockery, trepidation, panic, and even flirtation if they feel so inclined.

Experience expanded content. Explore the original worlds and core missions of “Fable” that thrilled Xbox gamers and discover additional regions, storylines and side quests, as well as optional missions with “Fable: The Lost Chapters.” In addition, “Fable: The Lost Chapters” offers the ability to fight new monsters, practice an expanded group of spells, don new armor, wield additional weapons and interact with new expressions.
Witness stunning graphics. “Fable: The Lost Chapters” is fully optimized for the Windows platform, bringing with it breath-taking graphics that allow you to view the world of Albion at its best.
Forge a hero based on actions. Eroii îmbătrânesc Heroes age and evolve through the actions players choose and the paths they follow — be it for good, evil or in between. Those who ply the way of the sword will see their muscles bulge. Those who weave the dark arts will witness power crackle at their fingertips. And those who rely on speed and stealth will develop lightning-like reflexes and eagle-eyed accuracy.
Engage in intense real-time combat. Players collect battle scars as they duel with cunning foes and deadly creatures. They can master an array of deadly weapons as they hone the art of blade-craft, hunt their quarry using subterfuge and stealth, or weave death from the elements as they harness the dark arts of the arcane.
Build a living legend. Through deeds and actions, “Fable: The Lost Chapters” players build a name for their character across the land. They can recruit allies and followers, gain glory or notoriety, make friends and enemies, the whole time interacting with a living world of people, places and events all reactive to them.
Shape and exploring a living, evolving world. Players champion or manipulate an ever-changing land with competitive and cooperative heroes, dynamic weather systems, and environments teeming with cultures, creatures, citizens and cities.
Hone scores of unique skills and extras. Players master new abilities and add possessions as their character develops. They can master the art of thievery, acquire a family, real estate, clothing or tattoos, and more. “Fable: The Lost Chapters” expands these offerings, providing the player with even more customization choices.
Never play the same game twice. Once an adventure has been completed

Official fact sheet from Lionhead Studios. "
14014,Hikaru no Go: Heian Gensou Ibunroku,hikaru-no-go-heian-gensou-ibunroku,Adventure,,PS,Konami,Tenky,,,,0.0,0.07,,,0.06,0.0,2002.0,,http://www.vgchartz.com/game/3490/hikaru-no-go-heian-gensou-ibunroku/?region=All,1,,/games/boxart/full_hikaru-no-go-heian-gensou-ibunroku_10JapanFront.jpg,0.07,"Hikaru no Go: Heian Gensou Ibunroku is a Board game, developed by KCEJ and published by Konami,  which was released in Japan in 2002. "
14015,Accel World vs. Sword Art Online: Millennium Twilight,accel-world-vs-sword-art-online-millennium-twilight,Action,T,PSV,Namco Bandai Games,Namco Bandai Games,,,,0.0,0.07,,,0.07,,2017.0,04th Jul 18,http://www.vgchartz.com/game/137626/accel-world-vs-sword-art-online-millennium-twilight/?region=All,1,,/games/boxart/full_7629821JapanFrontccc.jpg,0.07, 
14016,Samurai Shodown,samurai-shodown,Fighting,,NG,SNK,SNK Corporation,,,,0.0,0.07,,,0.07,,1993.0,,http://www.vgchartz.com/game/4230/samurai-shodown/?region=All,1,,/games/boxart/6205032ccc.jpg,0.07, 
14017,Sesame Street: Cookie's Counting Carnival,sesame-street-cookies-counting-carnival,Misc,EC,PC,Warner Bros. Interactive,Black Lantern Studios,,,,0.0,0.07,0.06,,,0.01,2010.0,,http://www.vgchartz.com/game/47287/sesame-street-cookies-counting-carnival/?region=All,1,,/games/boxart/full_sesame-street-cookies-counting-carnival_4AmericaFront.jpg,0.07, 
14018,OverBlood 2,overblood-2,Action,,PS,Evolution Games,Riverhillsoft,,,,0.0,0.07,,,0.06,0.0,2001.0,,http://www.vgchartz.com/game/3965/overblood-2/?region=All,1,,/games/boxart/full_6974261PALFrontccc.jpg,0.07,"The hidden top secret project of the government. The impenetrable Hayano Industries, the computers heavily guarded and protected by sophisticated electronics, the underground labyrinth and the enemies who appear on the way. After all the heroic fighting, would it be possible to develop a new future as expected? A 3D active RPG with a hint of adventure which reaches the extreme...!!
 
Source: Game Case "
14019,Operation: Vietnam,operation-vietnam,Shooter,T,DS,Majesco,Coyote Console,,,,0.0,0.07,0.06,0.0,,0.0,2007.0,,http://www.vgchartz.com/game/7181/operation-vietnam/?region=All,1,,/games/boxart/1243361ccc.gif,0.07,"
On a routine run over the Vietnam war-zone your chopper is taken down in VC territory. It's up to you and your squad to make it out of the VC infested region while liberating civilians. You're in total command as you make your way through war-torn Vietnam and eliminate the VC insurgence.

Command your squad of up to four soldiers at once 
Use the Touch Screen to issue commands, view the map, access inventory and select which squad member to control 
20 different jungle missions include rescuing POWs, saving civilians, hunting down VC, and more   
Utilize your squad to combat multiple enemy types including: soldiers, tanks, turrets, enemy barracks, etc. 
Take advantage of different specialties and weapons per solider: long range shot, grenade launcher, automatic weapons, etc. 
Beware land mines and other traps throughout war-torn Vietnam  
Flush out enemies with smoke grenades or take out a swarm of VC with fragmentation grenades 
Destructible environments filled with barrels, crates and animals add to the war experience

Majesco Entertainment "
14020,Fighter Maker 2,fighter-maker-2,Fighting,T,PS2,Agetec,Enterbrain,,,,0.0,0.07,0.03,0.03,,0.01,2002.0,,http://www.vgchartz.com/game/742/fighter-maker-2/?region=All,1,,/games/boxart/full_9552210AmericaFrontccc.jpg,0.07,"This Product is Part of the Designer Series  FOR SERIOUS FIGHTING GAME FANS ONLY!  Fighter Maker 2 gives you something you've never experienced before in a PS2 fighting game-the ability to build it yourself! In Fighter Maker 2 you get to build the world's greatest fighters from scratch using 3D models that respond to your every direction! The customization process includes costumes, body types, special moves, camera angles, and everything you need to create a personally designed cast of fighting characters that are ready to take on all comers! Also included is an entire 3D fighting game with a host of opponents ready to take your fighters apart! Once you prove your characters have what it takes to beat the locals, you can try your luck against your friend's fighters to see who can build the greatest fighter of all time!
Agetec "
14021,Lifeline,lifeline,Adventure,M,PS2,Konami,Sony Computer Entertainment,,,,0.0,0.07,0.03,0.03,,0.01,2004.0,,http://www.vgchartz.com/game/1181/lifeline/?region=All,1,,/games/boxart/709277ccc.jpg,0.07,"In Lifeline, you'll battle deadly creatures, solve puzzles, and escape from a space station--all with the sound of your voice. Trapped in the station's control room after a massive attack, you must use verbal communication--through the USB headset--to guide a female survivor, named Rio, around a hostile hotel environment. Voice commands, such as ""shoot and reload,"" ""dodge to the left,"" ""look behind you,"" and others, will come in handy as you battle vicious aliens. "
14022,Dragon Valor,dragon-valor,Role-Playing,T,PS,Namco,Namco,,6.1,,0.0,0.07,0.04,0.03,,0.0,2000.0,,http://www.vgchartz.com/game/24570/dragon-valor/?region=All,1,,/games/boxart/307777ccc.jpg,0.07, 
14023,Judie no Atelier: Guramnat no Renkinjutsushi,judie-no-atelier-guramnat-no-renkinjutsushi,Role-Playing,,PS2,Gust,Gust,,,,0.0,0.07,,,0.07,,2002.0,,http://www.vgchartz.com/game/2866/judie-no-atelier-guramnat-no-renkinjutsushi/?region=All,1,,/games/boxart/full_2197492JapanFrontccc.jpg,0.07, 
14024,Bad Apple Wars,bad-apple-wars,Action,T,PSV,Aksys Games,Aksys Games,,,,0.0,0.07,0.02,,0.04,0.01,2017.0,21st Sep 18,http://www.vgchartz.com/game/86223/bad-apple-wars/?region=All,1,,/games/boxart/full_5699103AmericaFrontccc.jpg,0.07,"
Life and death-there are numerous story  routes to discover and experience, from the heart-wrenchingly tragic to  the truly uplifting and inspiring.
Follow the myriad of twists and turns to discover the truth of the mysterious academy.
Warring factions-choose between the  cold-blood, rule-bound side of law and order, or embrace the anarchy of  the resistance and experience the story from two drastically different  viewpoints
Touch the soul- seek out the inner working  of the soul and use your touch screen in a fun and interactive way to  explore the depth of the characters and influence the story

Source: https://aksysgames.com/ "
14025,Jake Power: Handyman,jake-power-handyman,Adventure,E,DS,Ubisoft,Magic Pockets,,,,0.0,0.07,0.06,0.0,,0.01,2009.0,,http://www.vgchartz.com/game/30963/jake-power-handyman/?region=All,1,,/games/boxart/full_1614787AmericaFrontccc.jpg,0.07,"Help improve people's lives! Repair piping, build, clean up the city, and much more! Help improve people's lives! Collect awards and tools to simplify your repairs.
Customize your vehicle and get the best you can from it. Change the wheels, the hood, the bumper, the paint job, and much more "
14026,NHL 2005,nhl-2005,Sports,E,GC,EA Sports,EA Canada,,,,0.0,0.07,0.05,0.01,,0.0,2004.0,,http://www.vgchartz.com/game/5528/nhl-2005/?region=All,1,,/games/boxart/full_2013137AmericaFrontccc.jpg,0.07,"EA SPORTS™ lights it up in the 13th season of world championship hockey with EA SPORTS NHL® 2005. Delivering top shelf gameplay that captures the speed, finesse, and hard-hitting action of pro hockey, NHL 2005 challenges gamers of all skill levels to lace up their skates and create open ice.  New EA SPORTS Open Ice Control allows players to execute offensive plays such as Give-and-Go's and breakaway passes or call for a defensive double team with the touch of a button. A completely overhauled skating engine captures both the explosive speed of offensive skating and the surgical precision of backwards defensive movement.   EA SPORTS Dynasty Mode™ goes even deeper with a new, easier to navigate interface, and more interactive GM/owner relationships, including a deep new e-mail system.   NHL 2005 also delivers all the action of the World Cup of Hockey, with International Teams and venues from North America and Europe. In addition to all 30 NHL teams, NHL 2005 includes 39 teams from the Swedish, Finnish and German Elite Leagues, as well as 21 International teams.
 
Source - www.electronicarts.co.uk (publisher) "
14027,Midway Arcade Treasures 3,midway-arcade-treasures-3,Misc,E,GC,Midway Games,Digital Eclipse,,6.1,,0.0,0.07,0.05,0.01,,0.0,2005.0,,http://www.vgchartz.com/game/5359/midway-arcade-treasures-3/?region=All,1,,/games/boxart/full_9156699AmericaFrontccc.jpg,0.07,"Midway Arcade Treasures 3 is a collection of eight classic arcade racing games featuring insane jumps and stunts in RUSH: The Rock and RUSH 2049 along with jet boat adventures in Hydro Thunder. Test your arena-style 4x4 driving skills in Super Off Road or get down in the dirt with Off Road Thunder: Mud, Sweat and Gears. Experience stunt driving in Race Drivin’ or jump to the future for the post-nuclear battle of Badlands or shoot things up in S.T.U.N. Runner.  Source - www.Midway.com "
