Rank,Name,basename,Genre,ESRB_Rating,Platform,Publisher,Developer,VGChartz_Score,Critic_Score,User_Score,Total_Shipped,Global_Sales,NA_Sales,PAL_Sales,JP_Sales,Other_Sales,Year,Last_Update,url,status,Vgchartzscore,img_url,Global_Total,Summary
14477,Shiren The Wanderer: The Tower of Fortune and the Dice of Fate,shiren-the-wanderer-the-tower-of-fortune-and-the-dice-of-fate,Action,E10,PSV,Aksys Games,"Chunsoft Co., Ltd.",,,,0.0,0.06,0.01,,0.04,0.01,2016.0,22nd Sep 18,http://www.vgchartz.com/game/85649/shiren-the-wanderer-the-tower-of-fortune-and-the-dice-of-fate/?region=All,1,,/games/boxart/full_7251184AmericaFrontccc.png,0.06, 
14478,Cabela's Big Game Hunter (2008),cabelas-big-game-hunter-2008,Sports,T,X360,Activision,FUN Labs,,,,0.0,0.06,0.06,,,0.0,2007.0,,http://www.vgchartz.com/game/12591/cabelas-big-game-hunter-2008/?region=All,1,,/games/boxart/1724398ccc.jpg,0.06,"Take an incredible adventure to the world's marquee hunting locations in pursuit of the most sought-after and exotic big game trophy animals. You will need to put yout hunting skills and techniques to the test to master real-life hunting strategies and bring down legendary big game. Along your journey, you will meet hunting guides who will offer helpful hints, find unlockable hunts for birds and small game, and have surprise encounters with dangerous game. Are you ready for the hunting adventure of a lifetime?  Gameplay Features:  

24 trophy big game species including Elk, Moose, Mule Deer, Caribou, Kudu, Red Stag, Big Horn Sheep, Cape Buffalo, Wild Boar and Grizzly Bear.
Hunt for legendary big game animals in 10 trophy hunts. 
The world's top big game hunting locations including British Columbia, Montana, New Zealand, Africa and Argentina. 
Enjoy immersive environments with incredibly realistic terrain, changing seasons, extreme weather and more.
Dangerous game that will threaten and attack until a final encounter where you must use your hunting skill to bring it down.
Real-life hunting strategies you will need to master include glassing, stalking, tracking, long-range shooting, baiting, stands, blinds and more!
Unlockable hunts and gear - each hunting environment will come to life, motivating you to explore and find hidden hunts and upgraded items. 
Unlock hunts for over 20 species of small game, waterfowl and upland birds. 
New hunting aids and shooting controls including adrenaline, stalking and tracking modes, and hunter sense which will highlight animals in their surroundings, allowing you to lock on and track their movements. 
Hunting guides - keep your eyes and ears open for local guides who offer helpful hints and suggestions you need in your quest to bag record-setting big game. 
Authentic weapons, gear and equipment modeled using the latest 3D technology for an incredibly realistic look.

 
Activision "
14479,Neon Genesis Evangelion,neon-genesis-evangelion,Action,,N64,Bandai,Bandai,,5.6,,0.0,0.06,,,0.06,0.0,1999.0,,http://www.vgchartz.com/game/3915/neon-genesis-evangelion/?region=All,1,,/games/boxart/full_3877522JapanFrontccc.jpg,0.06,"Neon Genesis Evangelion is an Action game, developed and published by Bandai,  which was released in Japan in 1999. "
14480,Serious Sam II,serious-sam-ii,Shooter,M,XB,2K Games,Croteam,,,,0.0,0.06,0.05,0.01,,0.0,2005.0,,http://www.vgchartz.com/game/2012/serious-sam-ii/?region=All,1,,/games/boxart/full_833474AmericaFrontccc.jpg,0.06,"
The series famous for relentless intensity is bigger, better looking and more frantic than ever before. Built from the ground up with a completely new engine, Serious Sam 2 is a shot of adrenaline to the hearts of first-person shooter fans across the world. This is serious!


Runs on the newly designed Serious 2 engine with graphics, environments and physics that are 100 times more complex than previous Serious Sam games. 
Maintains the same level of extreme action that Serious Sam is known for. Despite its jaw-dropping visuals, Serious Sam 2 will surpass the onscreen enemy benchmark that the original Serious Sam games set. 
Over 40 beautiful, expansive levels spread out over 7 unique environments. Sam will travel through thick jungles, murky swamps, frozen tundra, futuristic cities, volcanic planets, and more. Each level is seriously enormous! 
45 newly designed enemy types for Sam to face. The Serious Sam series is known for its outrageous enemy personalities, and Serious Sam 2 will give players a lot more to laugh about. 
New vehicular and animal-back combat! Engage in heart-thumping action atop wild, mountable animals and intense, death-dealing vehicles. 
Online play for both PC and Xbox. 

2kgames.com
  "
14481,World Series of Poker 2008: Battle for the Bracelets,world-series-of-poker-2008-battle-for-the-bracelets,Misc,T,DS,Activision,Farmind Ltd,,,,0.0,0.06,0.05,0.0,,0.0,2007.0,,http://www.vgchartz.com/game/12621/world-series-of-poker-2008-battle-for-the-bracelets/?region=All,1,,/games/boxart/7382566ccc.gif,0.06,"Enter the largest sporting event in the world - the Wolrd Series of Poker, and battle ""The Poker Brat"" Phil Hellmuth along the way! Build your bankroll and face off against some of the world's top pros in your quest to win the championship bracelet for the $10,000 Main Event.
 
Source - www.activision.com (publisher)
 "
14482,Foster's Home for Imaginary Friends: Imagination Invaders,fosters-home-for-imaginary-friends-imagination-invaders,Adventure,E,DS,Midway Games,Sensory Sweep,,,,0.0,0.06,0.06,,,0.0,2007.0,,http://www.vgchartz.com/game/12744/fosters-home-for-imaginary-friends-imagination-invaders/?region=All,1,,/games/boxart/full_3290772AmericaFrontccc.jpg,0.06,"For the first time on the Nintendo DS experience the fun of Cartoon Network's hit show in Foster's Home for Imaginary Friends: Imagination Invaders, playing as head mischief-maker Blooregard Q. Kazoo. Goo has done it again... her overactive imagination has conjured up a group of diabolical cosmic invaders, the Space Nut Boogies. They've raided Foster's Home for Imaginary Friends and taken Madame Foster hostage in search of The Greatest Thing in the Universe, and it's up to you to stop them! Play as Bloo as you explore the Foster's house, sneak past the Space Nut Boogie guards, and gather Mac, Coco, Eduardo and the rest of the gang to rescue Madame Foster!

http://www.midway.com/rxpage/Game_Foster'sHomeforImaginaryFriends:ImaginationInvaders.html "
14483,Flipnic: Ultimate Pinball,flipnic-ultimate-pinball,Misc,E,PS2,Capcom,Sony Computer Entertainment,,,,0.0,0.06,0.03,0.02,,0.01,2005.0,,http://www.vgchartz.com/game/778/flipnic-ultimate-pinball/?region=All,1,,/games/boxart/4239481ccc.jpg,0.06,"Not since the days of Amiga's fiendishly addictive 'Pinball Dreams' has a ball-bearing-based title captured the imaginations of this dedicated team of fin-flippers here at PlayStation.com quite so completely. The arrival of this unmistakably Japanese offering was greeted with unprecedented levels of excitement in the office when the quote on the front of the box was read aloud by staff writer and self-proclaimed pinball sim pro Dan Maher: ""Flipnic is an enjoyable simple-action amazing pinball game for you"". And UbiSoft's delightfully surreal game is just that, a wonderfully entertaining slice of ball-flipping action that anyone can enjoy.
The first thing you'll notice when you get your mitts on Flipnic is just how huge the 'tables' are. Based on five different themes, including Jungle, Techno and Metal, these unique worlds contain stunning landscapes, complete with their own individual wildlife, flora and fauna. The first set of tables has a lush tropical look, with butterflies floating over the game as you frantically bash buttons in an attempt to achieve Flipnic's surreal objectives. The challenges include saving pink flamingos from the jaws of hungry crocodiles, destroying UFOs, and feeding hungry monkeys by knocking bananas into their waiting paws. And when you're not putting your mean pinballing skills to the test in single-player mode, you can also throw down the gauntlet to friends in multiplayer modes, with Pinball Soccer and Pinball Basketball available for two-player action. Possibly the most surreal addition to the genre, Flipnic sports beautifully vibrant graphics, intuitive controls, and some of the best ball physics you'll ever encounter in a pinball sim "
14484,ICO,ico,Adventure,,PS3,Sony Computer Entertainment,Bluepoint Games,,,,0.0,0.06,,,0.06,,2011.0,,http://www.vgchartz.com/game/48358/ico/?region=All,1,,/games/boxart/full_ico_581JapanFront.jpg,0.06,"
Solve the puzzles or join the tormented souls forever. He was born with horns. For this, they feared him. At first, he was  ostracized. Then he was entombed. Then he was forgotten. Only, one day,  he escaped his burial crypt. In the outside world, he found himself  within a castle, and within that castle he found a peculiar girl. Her  name is Yorda. His name is Ico. And the castle had no name, nor did it  have an exit or an explanation of its existence...only dangers and  menacing spirits...
 
Source: us.playstation.com
 "
14485,Eigo de Tabisuru: Little Charo,eigo-de-tabisuru-little-charo,Misc,,DS,Nintendo,Nintendo,,,,0.0,0.06,,,0.06,,2011.0,,http://www.vgchartz.com/game/49086/eigo-de-tabisuru-little-charo/?region=All,1,,/games/boxart/full_eigo-de-tabisuru-little-charo_217JapanFront.jpg,0.06,"Eigo de Tabisuru: Little Charo is an Edutainment game, developed and published by Nintendo,  scheduled to be released in Japan in 2011. "
14486,NBA Hangtime,nba-hangtime,Sports,E,PS,Midway Games,Midway Games,,,,0.0,0.06,0.03,0.02,,0.0,1997.0,,http://www.vgchartz.com/game/42798/nba-hangtime/?region=All,1,,/games/boxart/full_4288556AmericaFrontccc.jpg,0.06,"Real-time, 3D NBA basketball simulation with online league capabilities.
High-Voltage.com "
14487,MX vs. ATV Supercross Encore,mx-vs-atv-supercross-encore,Sports,E,XOne,Nordic Games,Rainbow Studios,,,,0.0,0.06,0.05,,,0.01,2015.0,27th Jun 18,http://www.vgchartz.com/game/86126/mx-vs-atv-supercross-encore/?region=All,1,,/games/boxart/full_1376577AmericaFrontccc.jpg,0.06, 
14488,D.C. II P.S.: Da Capo II Plus Situation,dc-ii-ps-da-capo-ii-plus-situation,Adventure,,PS2,Kadokawa Shoten,Circus,,,,0.0,0.06,,,0.06,,2008.0,,http://www.vgchartz.com/game/23084/dc-ii-ps-da-capo-ii-plus-situation/?region=All,1,,/games/boxart/full_3179985JapanFrontccc.jpg,0.06,"D.C. II P.S.: Da Capo II Plus Situation is an Adventure game, developed by Circus and published by Kadokawa Shoten,  which was released in Japan in 2008. "
14489,MotoGP 10/11,motogp-10,Racing,E,X360,Capcom,Monumental Games,,6.0,,0.0,0.06,,0.05,,0.01,2011.0,,http://www.vgchartz.com/game/48480/motogp-1011/?region=All,1,,/games/boxart/full_motogp-1011_703AmericaFront.jpg,0.06, 
14490,World Cup of Pool,world-cup-of-pool,Sports,E,DS,Aksys Games,Midas Interactive Entertainment,,,,0.0,0.06,0.06,0.0,,0.0,2010.0,,http://www.vgchartz.com/game/18803/world-cup-of-pool/?region=All,1,,/games/boxart/full_9707849AmericaFrontccc.jpg,0.06,"When you want to be the best you have to beat the best. This means taking on and defeating Earl ""the Pearl"" Strickland, Efren Reyes, Francisco Bustamante, Ronnie O'Sullivan and current World Champion Daryll Peach - and that's just what you can do in World Cup of Pool!

Featuring over 60 of the world's top players - with over 15 Pool and Snooker world titles between them - prove you're a winner at 8-ball & 9-ball and claim the ultimate prize in any sport - the World Cup. "
14491,Brunswick Circuit Pro Bowling,brunswick-circuit-pro-bowling,Sports,E,N64,THQ,Point of View,,,,0.0,0.06,0.05,0.01,,0.0,1999.0,,http://www.vgchartz.com/game/262/brunswick-circuit-pro-bowling/?region=All,1,,/games/boxart/full_8989990AmericaFrontccc.jpg,0.06,"Now every night is bowling night! Unsurpassed bowling physics engine for ultra-realistic ball and pin action. Cosmic bowling for lights-down, glow-in-the-dark bowling fun! Play as one of the Brunswick ProStaff, or create your own bowler. Authentic play modes, including tournaments, opens, and Skins games. The ultimate party game for up to six players! "
14492,Bust-A-Move '99,bust-a-move-99,Puzzle,E,N64,Acclaim Entertainment,Distinctive Developments Ltd,,,,0.0,0.06,0.05,0.01,,0.0,1999.0,,http://www.vgchartz.com/game/280/bust-a-move-99/?region=All,1,,/games/boxart/full_5092439AmericaFrontccc.jpg,0.06, 
14493,CyberTiger,cybertiger,Sports,E,N64,Electronic Arts,Saffire Corporation,,,,0.0,0.06,0.05,0.01,,0.0,2000.0,,http://www.vgchartz.com/game/441/cybertiger/?region=All,1,,/games/boxart/890496ccc.jpg,0.06,"Rip up the rules book - anything goes! Create your own golfer to take on CyberTiger and the many other characters. Real-time analog swing and ball control - hit a fade or a draw, add topspin or backspin, all in mid-flight. Sandtraps and tall rough are just the beginning. Seven modes of play: Strokes, Skins, Match, Tournament, Practice, Driving Range and the all-new Battle and Club Challenge modes. More ways to get on the green - superdrives, hidden tricks, hidden courses, hidden golfers, and tons of secret skills! "
14494,Marvel Super Heroes,marvel-super-heroes,Fighting,T,SAT,Capcom,Capcom,,,,0.0,0.06,,,0.06,0.0,1997.0,,http://www.vgchartz.com/game/3725/marvel-super-heroes/?region=All,1,,/games/boxart/2090593ccc.jpg,0.06,"Play as your favorite Marvel Character: Wolverine, Spider-Man, The Incredible Hulk, Captain America, Iron Man, Psylocke, Shuman-Gorath, BlackHeart, Juggernaut or Magneto. Power up with an Infinity Gem - grant your Super Hero healing power, super attacks and increased strength.

VIBRANT ANIMATION  
HUGE CHARACTERS  
POWERFUL GEMS  
EARTH-SHATTERING COMBAT

A spectacular translation of Capcom's #1 ranked arcade blockbuster
[US Back Cover] "
14495,Mike Piazza's Strike Zone,mike-piazzas-strike-zone,Sports,E,N64,GT Interactive,Devil's Thumb Entertainment,,,,0.0,0.06,0.05,0.01,,0.0,1998.0,,http://www.vgchartz.com/game/1359/mike-piazzas-strike-zone/?region=All,1,,/games/boxart/6800203ccc.jpg,0.06,"DIG IN! Over 700 players! All the stadiums! All the teams and uniforms! All in 3D! Unique player editor allows you to create the ultimate athlete. All new 1998 rosters including two new expansion teams: Arizona Diamondbacks and Tampa Bay Devil Rays! Tons of hidden secrets including super-fast pitches, outrageous curve balls, incredible home runs and more! Fantasy Teams: Create your own rotisserie league. Ultra-realistic conditions affect gameplay: Grass and turf. Day and night. Rain or shine. "
14496,Olympic Hockey 98,olympic-hockey-98,Sports,E,N64,Midway Games,Treyarch,,,,0.0,0.06,0.05,0.01,,0.0,1998.0,,http://www.vgchartz.com/game/1670/olympic-hockey-98/?region=All,1,,/games/boxart/4396064ccc.jpg,0.06,"For the first time in history, NHLPA pros are descending upon the Olympic Winter Games. Be a witness as regular season opponents join together as teammates. Kamensky and Yashin are laced up for Russia. Kariya and Roy get the nod for Canada. Modano and Leetch are in for the United States. The rosters are real. The graphics will make you sweat. It's country against country in this engagement. And the price of glory isn't gonna be pretty! "
14497,Penny Racers,penny-racers,Racing,E,N64,THQ,Locomotive Games,,,,0.0,0.06,0.05,0.01,,0.0,1999.0,,http://www.vgchartz.com/game/1723/penny-racers/?region=All,1,,/games/boxart/full_1254467AmericaFrontccc.jpg,0.06,"Kart racing at its best! 13 cool Penny racers body styles. Perform insane stunts like power slides, drifting, wheelies and ""barrel rolls."" Nearly 100 upgrades, modifications and weapons to choose from. Four-player split-screen mayhem and a Track Editor for unlimited courses! "
14498,Polaris SnoCross,polaris-snocross,Racing,E,N64,Vatical Entertainment,Vicarious Visions,,,,0.0,0.06,0.05,0.01,,0.0,2000.0,,http://www.vgchartz.com/game/28890/polaris-snocross/?region=All,1,,/games/boxart/full_4225662AmericaFrontccc.jpg,0.06,"If it doesn't say Polaris... it ain't SnoCross! Join the Polaris Snowmobile Racing Team and dare to tame the mountain! Pull off a variety of insane tricks as you master the challenges of monster jumps, hidden pitfalls, shortcuts, and treacherous terrain. Race against fiercely competitive AI characters, or take on your own friends in multi-player mode. Feel your customized Polaris sled move, twist and turn just like a real snowmobile! "
14499,S.C.A.R.S,scars,Racing,E,N64,Ubisoft,Vivid Image,,,,0.0,0.06,0.05,0.01,,0.0,1998.0,,http://www.vgchartz.com/game/1960/scars/?region=All,1,,/games/boxart/9043732ccc.jpg,0.06,"Untamed racing in the ultimate killer cars! Nine brutal 3D tracks across volcanoes, jungles, oceans and more. Nine killer cars armed with missiles, time bombs, boomerangs and more. Night and rain racing. Challenge, Grand Prix, and Custom Cup racing! Two and four player racing. "
14500,Star Soldier: Vanishing Earth,star-soldier-vanishing-earth,Shooter,E,N64,Electro Brain,Hudson Soft,,,,0.0,0.06,0.05,0.01,,0.0,1998.0,,http://www.vgchartz.com/game/2183/star-soldier-vanishing-earth/?region=All,1,,/games/boxart/3828245ccc.jpg,0.06,"In the year 2098 mankind had been critically attacked by a military force from Zeograd, a hostile planet in a far off galaxy. Commander Parker Deehan of Special Interception Airforce (SIA), decided to deploy and pilot the F98 Star Soldier fighter craft into the front line of battle against Zeograd. Loosing the battle meant the extinction of mankind and the total annihilation of Earth!

Pilot and fight your way through numerous enemies
Stock up to use GB Bombs, Fire Bombs or Mega Lasers

- From game back cover "
14501,Top Gear Hyper-Bike,top-gear-hyper-bike,Racing,E,N64,Kemco,Snowblind Studios,,,,0.0,0.06,0.05,0.01,,0.0,2000.0,,http://www.vgchartz.com/game/2499/top-gear-hyper-bike/?region=All,1,,/games/boxart/1525376ccc.jpg,0.06,"Big air. Fast tracks. Snarling competitors. Whether you're into high-flying motocross racing or knee-scraping street bike action, Top Gear Hyper Bike opens the throttle on gritty, two-wheeled fun. Strap on your brain bucket and test these features: Four incredible modes of play, Track Editor to create your own mind-blowing tracks, race on the street and in the dirt using 16 authentic race bikes from Kawasaki, Yamaha and Honda, unlock hidden bikes and bonus courses by winning race seasons in Championship Mode. "
14502,Virtual Chess 64,virtual-chess-64,Misc,E,N64,Titus,Titus Software,,,,0.0,0.06,0.05,0.01,,0.0,1998.0,,http://www.vgchartz.com/game/2615/virtual-chess-64/?region=All,1,,/games/boxart/9087201ccc.jpg,0.06,"Titus has introduced the first chess simulation for the N64, Virtual Chess. Even with most of the options available to PC chess players, 14 skill levels to choose from, and animated fight scenes for the kiddies, the 3D view's lack of visual clarity makes for a frustrating game.Virtual Chess offers most of the options computerized chess should. For the novice, there's a simple but thorough tutorial. Broken up into slim chapters, it's easy to use, whether you're just verifying the rules for taking pawns ""en passant,"" or trying queenside castling for the first time. A save-game feature allows you to see just how stupid a move is before committing to it permanently. Unfortunately, there's no option to just retake the last move, so if you're hesitant, save early and save often. If you're still feeling squeamish, there's an onscreen CPU next-move suggestion button available at all times. Play in Virtual Chess is plain hard to see. The pieces are difficult to tell apart from any angle, so you've got to be extra careful to avoid stupid mistakes (or be surprised when the enemy ""king"" easily avoids check by sliding across the entire board). To this end, plan on spending a lot of time rotating the board, which turns a full 360 degrees horizontally or vertically. If you were some kind of crazy nut, you could even attempt to play looking at the felt on the bottom of the board. Unfortunately, the board only spins on either axis in one direction, so if you miss your spot, you have to go all the way around again. Thankfully, a 2D version is also included, but that removes the whole point of the game: the fight animations.The game would be better off without them anyway. Had they occurred on the regular playing screen, that would have been one thing. Such is not the case. Every time a piece is captured, all the pieces shoot into the air, the screen goes all crazy, and... the board appears again, with a cutscene featuring stylized representations of the capturing piece and its victim squared off to fight. The black knight is a battering ram, the white a unicorn. The black bishop is some sort of mosquito creature, the white a wizard. The black queen is overweight. Yawn. The animations are jerky and slow and lose their appeal after the third time or so. Thankfully, they may be turned off.Ever since R2D2 and Chewbacca first played their first near-deadly game of holographic chess (""Let the wookie win""), it's seemed like a good idea to offer a chess simulation that comes equipped with 3D fighting sequences for the captures - and this did prove somewhat successful with Empire Interactive's Combat Chess for the PC. Unless the fighting actually occurs fully rendered using the same engine as the rest of the game, rather than as an annoyingly distracting cutscene, the novelty will always fade fast. Masters and novices alike will probably quickly strip Virtual Chess down to its clearer, more practical 2D mode after a minimum of laughs are achieved from the fights. Even in this mode, the game provides a great tool for fans of the ""real thing"" of any skill level. "
14503,Worms Blast,worms-blast,Puzzle,E,GC,Ubisoft,Team17 Software,,,,0.0,0.06,0.05,0.01,,0.0,2002.0,,http://www.vgchartz.com/game/2723/worms-blast/?region=All,1,,/games/boxart/7747570ccc.jpg,0.06," 
WORMS BLAST GAME The Worms are back, always ready for a fight on the sea. With a vast array of addictive game modes and options, use your strategic and reflex skills in this action puzzle game. Select your weapon, aim, blast your opponent and listen to his shrieks! With this quick addictive kill-him before he kills you gameplay, you will never be so happy to see your opponent sink or drown!
Play numerous single player missions and multi-player modes.
Control a crew of new Worms characters with their own boats to terrorise the waves!
Choose your weapon from an impressive array including wacky sea life, piranha, sea monsters and fish food! Features cartoon-style backgrounds in a variety of action-packed locations. Enjoy the pure wormage!
Source: ubi.com "
14504,Prinny: Can I Really Be The Hero? (US sales),prinny-can-i-really-be-the-hero-us-sales,Action,T,PSP,NIS America,Nippon Ichi Software,,,,0.0,0.06,0.06,,,,2009.0,03rd Jan 19,http://www.vgchartz.com/game/49877/prinny-can-i-really-be-the-hero-us-sales/?region=All,1,,/games/boxart/full_7690107AmericaFrontccc.jpg,0.06, 
14505,Blur,blur,Racing,E10,PC,Activision,Bizarre Creations,,8.1,,0.0,0.06,0.01,0.04,,0.01,2010.0,,http://www.vgchartz.com/game/38149/blur/?region=All,1,,/games/boxart/full_blur_6AmericaFront.jpg,0.06,"Blur is the ultimate powered-up racing experience, dropping you into electrified action with a mass of cars targeting the finish line and battling each other as they trade paint.  Utilize an armory of power-ups like huge bursts of energy, defensive shields, nitro speed boosts, landmines, and more to beat your rivals across the finish line. You choose how and when to use your arsenal of power-ups for ultimate impact in a race where the outcome is never certain. Blur’s story unfolds through a unique community-based social network interface that includes 4-player split-screen multiplayer and online multiplayer. Blur is non-stop Powered-up Racing:  An intense, unpredictable fight to the finish.
Power-ups: Collect a variety of addictive dynamic power-ups and use them independently or combo them strategically to take out your opponents. Real Racing: Insane collisions and stunning racing environments in real world locations and licensed photo-realistic cars add to the intensity. Social Network: Unique story-driving social network interface evolves as you compete in different races, make new friends, rivals and fans, and connect with other racers both in game and in real life. Multi-player: Features online multiplayer supporting competitive and cooperative game play for up to 20 racers and 4-player split-screen.
www.activision.com "
14506,Killing Floor 2,killing-floor-2,Shooter,M,XOne,Tripwire Interactive,Tripwire Interactive,,,,0.0,0.06,0.05,,,0.01,2017.0,30th May 18,http://www.vgchartz.com/game/191222/killing-floor-2/?region=All,1,,/games/boxart/full_1815063PALFrontccc.jpg,0.06,"In  KILLING FLOOR 2, players descend into continental Europe after it has  been overrun by horrific, murderous clones called Zeds that were created  by the corporation Horzine. The Zed outbreak caused by Horzine  Biotech’s failed experiments has quickly spread with unstoppable  momentum, paralyzing the European Union. Only a month ago, the first Zed  outbreak from the original KILLING FLOOR ripped through London; now the  specimen clones are everywhere. Civilization is in disarray,  communication networks have failed, governments have collapsed, and  military forces have been systematically eradicated. The people of  Europe are now focused on self-preservation, the lucky few who survived  having gone into hiding.
But  not all have given up hope; a motley group of civilians, soldiers, and  mercenaries have banded together to fight the outbreaks from privately  funded bases across Europe.  When a specimen clone outbreak is detected,  the players are sent into Zed-laden hot zones to exterminate all  threats using whatever means necessary. Welcome to the Killing Floor.
Source: http://www.killingfloor2.com "
