Rank,Name,basename,Genre,ESRB_Rating,Platform,Publisher,Developer,VGChartz_Score,Critic_Score,User_Score,Total_Shipped,Global_Sales,NA_Sales,PAL_Sales,JP_Sales,Other_Sales,Year,Last_Update,url,status,Vgchartzscore,img_url,Global_Total,Summary
14221,Super Bomberman R,super-bomberman-r,Puzzle,E10,PS4,Konami Digital Entertainment,HexaDrive,,,,0.0,0.06,0.03,,0.03,0.01,2018.0,24th Sep 18,http://www.vgchartz.com/game/221491/super-bomberman-r/?region=All,1,,/games/boxart/full_2069050AmericaFrontccc.jpg,0.06,"Story Mode
More than 50 levels awaits you in the Story Mode, playable alone or with a friend.
Fight against the Evil Emperor Buggler in order to bring back peace in the Universe!
The 8 Bomberman Rangers, sworn protectors of the universe, take on the Evil Emperor Buggler and 5 dastardly Bombers. Our heroes will battle their way through 5 different but dangerous worlds, and face 5 villains in epic boss fights as they do.
Battle Mode
In Battle Mode, nearby or on the other side of the planet, up to 8  people can play together (you can connect up to 4 Nintendo Switch™).
Amazing new maps for unpredictable battles!
Source: https://www.konami.com/ "
14222,ESPN Winter X-Games: Snowboarding 2002,espn-winter-x-games-snowboarding-2002,Sports,E,GBA,Konami,KCEO,,,,0.0,0.06,0.05,0.02,,0.0,2001.0,,http://www.vgchartz.com/game/26821/espn-winter-x-games-snowboarding-2002/?region=All,1,,/games/boxart/1235810ccc.jpg,0.06,"With real professional snowboarders, boards, and other assorted gear, ESPN's Winter X Games Snowboarding 2002 is one exciting trick-based snowboarding game.  Starring gold medallists Peter Line as well as over 12 other top-notch snowboarders, this PS2 snow-shredder boasts pre- and post-race coverage, with statistics from the biggest names in the sport.
Playstation "
14223,Bleach: Versus Crusade,bleach-versus-crusade,Fighting,,Wii,Sega,"Treasure Co., Ltd.",,,,0.0,0.06,,,0.06,,2008.0,27th Nov 18,http://www.vgchartz.com/game/27703/bleach-versus-crusade/?region=All,1,,/games/boxart/full_4806277JapanFrontccc.jpg,0.06, 
14224,Insecticide,insecticide,Adventure,E10,DS,Gamecock,"Crackpot Entertainment / Creat Studios, Inc.",,,,0.0,0.06,0.06,,,0.01,2008.0,,http://www.vgchartz.com/game/14762/insecticide/?region=All,1,,/games/boxart/5184726ccc.jpg,0.06,"
Untangle a sticky web of crime
Insecticide is a hard-boiled, fast-shooting detective game set in a        festering future city where bugs have evolved as the planet’s dominant        race. A murder at the powerful Nectarola soft drink company leads police        from the Insecticide Squad on a bug hunt through the city’s seedy        underbelly, and into a mystery of epic proportions.

 Unique insect abilities 
 bug weaponry 
 Old fashioned street smarts 
 Crime solving cleverness 

Nintendo "
14225,Aven Colony,aven-colony,Strategy,E10,XOne,Sold Out,Mothership Entertainment,,,,0.0,0.06,0.06,,,0.01,2017.0,25th Jun 18,http://www.vgchartz.com/game/173110/aven-colony/?region=All,1,,/games/boxart/full_3455500AmericaFrontccc.jpg,0.06, 
14226,Kanon,kanon,Adventure,,DC,NEC Interchannel,Key,,,,0.0,0.06,,,0.06,,2000.0,,http://www.vgchartz.com/game/3568/kanon/?region=All,1,,/games/boxart/full_6104117JapanFrontccc.jpg,0.06,"Kanon is an Adventure game, developed and published by NEC Interchannel,  which was released in Japan in 2000. "
14227,NanoBreaker,nanobreaker,Action,M,PS2,Konami,Konami Computer Entertainment Tokyo,,,,0.0,0.06,0.03,0.02,,0.01,2005.0,,http://www.vgchartz.com/game/22965/nanobreaker/?region=All,1,,/games/boxart/5433711ccc.jpg,0.06,"In the distant future, nanotechnology goes awry and nanomachines start to harvest the blood of humans in an effort to construct an army of monster machines. To defend the world from this certain apocalypse, players control a military cyborg who wields a powerful, shape-shifting Plasma Blade. Using a variety of fighting techniques, hack and slash through hordes of enemy units to save humanity! FeaturesIntense hack and slash 3D action with hordes of enemy units Transformable Plasma Blade offers a myriad of attacks Combo based fighting system with simple and expert techniques Multiple gameplay modes, including Story and Time AttackKonami America "
14228,Bionicle,bionicle,Platform,E,XB,Electronic Arts,Argonaut Games,,,,0.0,0.06,0.05,0.01,,0.0,2003.0,,http://www.vgchartz.com/game/4875/bionicle/?region=All,1,,/games/boxart/6974181ccc.jpg,0.06," In a time before time, in a world you've only imagined, a shadow has been cast, six heroes have been chosen and the greatest of all challenges has been laid down. With the awesome elemental powers of the Toa at your fingertips, it has fallen to you to defeat Makuta and return the island of Mata Nui to light. Live out the BIONICLE™ legend in an action adventure epic of good versus evil, with combat, collection, puzzle-solving and exploration.  Playing as the Toa, Toa Nuva and finally the 7th Toa, you must explore the six elementally-themed regions of Mata Nui - a tropical paradise of high mountains, great lakes and mighty volcanoes - rescue the scattered Matoran and break the spell of darkness sent by the evil Makuta.  In doing so you will face danger in equal measure from the island's many environmental hazards (including falling rocks, rainforest winds, icicles and lava falls) and the foul minions of Makuta. So whether you're a skilled player or a young gamer, the time has come to emerge from behind your mask. The fate of Mata Nui is now in your hands...
 
Source - www.electronicarts.co.uk (publisher) "
14229,Escape from Bug Island,escape-from-bug-island,Action,M,Wii,Eidos Interactive,Spike,,,,0.0,0.06,0.04,0.01,0.01,0.0,2007.0,,http://www.vgchartz.com/game/7085/escape-from-bug-island/?region=All,1,,/games/boxart/7826044ccc.jpg,0.06,"As Ray, you wake up alone in a deep and fog covered forest. Your friends        are nowhere to be found. It was supposed to be a cozy night camping in        the woods... until strange creatures rose from the darkness. You must        find your friends, survive the horrific forest and get off the island in        one piece.
Features

 Use the Wii Remote and Nunchuk controllers to overcome obstacles          scattered throughout the island. Swinging bridges, pitfalls, falling          rocks and insect nests. 
 Squash, smash and stump giant bugs and eerie mutants using the Wii          Remote. Exterminate hundreds of insects by mastering dozens of weapons          with different attack techniques. Rifles, grenades, sickles, rocks and          much more. 
 Enter the ""Cave of Time"" and travel back through time to save the          lives of your friends. 
 Explore the devilish island, survive the creatures in a world only          visible through your flashlight. 
 Discover weapons and unlock special items to help you in your quest          for survival. 

Nintendo "
14230,Adventure Time: Finn & Jake Investigations,adventure-time-finn-amp-jake-investigations,Action,E10,XOne,Little Orbit,Vicious Cycle,,,,0.0,0.06,0.04,0.02,,0.01,2015.0,17th Mar 18,http://www.vgchartz.com/game/85405/adventure-time-finn-amp-jake-investigations/?region=All,1,,/games/boxart/full_8075055PALFrontccc.jpg,0.06,"Adventure Time: Finn and Jake Investigations is an all-new,  story-driven graphic adventure game. Strange stuff is happening in the  Land of Ooo (stranger than usual anyway). Luckily, Finn and Jake are on  the case. This mysterious adventure will put their detective skills to  the test as they search for clues, interrogate witnesses and piece  together the evidence to save the day. They might even have to bust up a  few goons along the way, but it’s nothing that Finn and Jake  Investigations can’t handle!

Features:

Sleuth your way through five cases set in the Land of  Ooo, each of which plays out a separate chapter (like your own personal  episode of the show).
See the Adventure Time characters and familiar locations for the first time in 3D.
Tackle puzzles by creatively using inventory objects and Jake’s shape-shifting abilities.
Combat evildoers as Finn using a variety of unique swords and Jake’s awesome attack forms.

Source: Publisher "
14231,Persona 5: Dancing in Starlight,persona-5-dancing-in-starlight,Music,T,PS4,Atlus,Atlus,,,,0.0,0.06,0.03,,0.03,0.01,2018.0,13th Aug 18,http://www.vgchartz.com/game/220290/persona-5-dancing-in-starlight/?region=All,1,,/games/boxart/full_2477393AmericaFrontccc.jpg,0.06,"The Phantom Thieves return for a new heist! Will they be able to steal your heart through dance in the mysterious Club Velvet? Don’t miss this new rhythm game featuring the familiar characters from the hit, Persona 5!

Memorable Soundtrack - Dance into the world Persona 5 and play stages featuring acclaimed music by Shoji Meguro, composed by Ryota Kozuka, as well as all-new remixes! Unlock a total of 25 fan-favorite tracks in each game.
Dancing! - Choose from several difficulty levels and dance alongside the members of the legendary Phantom Thieves in a customizable rhythm game experience. Characters can tear up the dance floor with a partner by performing well during a song and entering ""Fever"" mode; try out some of your favorite character combinations!
English and Japanese Voiceovers - Choose to listen to your favorite characters' voices in either English or Japanese with dual audio options! English, French, Italian, German, and Spanish subtitles are also available.
Social - In ""Social,"" players can connect with their favorite characters and deepen their social bonds through conversations and mini-events. Fulfill character-specific conditions to unlock special events and unlock new items.
Collect Costumes - Collect and equip a variety of costumes and accessories to create an even flashier dance experience.

 
Source: Atlus. "
14232,Guitar Freaks 3rdMIX & DrumMania 2ndMIX,guitar-freaks-3rdmix-amp-drummania-2ndmix,Simulation,,PS2,Konami,Konami,,,,0.0,0.06,,,0.06,,2000.0,,http://www.vgchartz.com/game/3441/guitar-freaks-3rdmix-amp-drummania-2ndmix/?region=All,1,,/games/boxart/9369436ccc.jpg,0.06, 
14233,Monster Madness: Grave Danger,monster-madness-grave-danger,Shooter,T,PS3,SouthPeak Interactive,Psyonix Studios,,,,0.0,0.06,0.05,0.01,,0.01,2008.0,,http://www.vgchartz.com/game/21684/monster-madness-grave-danger/?region=All,1,,/games/boxart/full_monster-madness-grave-danger_373AmericaFront.jpg,0.06,"
It's up to the youth of today to be the leaders of tomorrow, or at least to lay some serious discipline on the many marauding monsters that threaten to overwhelm our very existence!
So many ways to rumble! Explore the 18 gigantic levels full of panic-inducing pixel pleasure in Adventure Mode. You'll be lucky to survive, but if you do, you'll save the suburb from a fate worse than un-death!
Misery loves company, and you'll enjoy bringing some to the zombie-strewn streets when you join up for local and online co-op Adventure Mode, Multiplayer action like Capture the Flag and Deathmatch online via GameSpy™, or together on your very own console in Versus Mode.
Features

Online Co-Op Mode - Full Online Co-Op adventure mode with up to 4 players, including multiple local ""guests"", with all gameplay features online
Over 100 purchasable character power-up accessory items. Each contains unique gameplay customizations that are specific to each player
Brand New Challenges! - 25 New challenge missions and party games to test players' Monster slaying skills
Character Customization! - 16 New character costumes that can be used in local and online play



SouthPeak "
14234,Mark McMorris Infinite Air,mark-mcmorris-infinite-air,Sports,T,PS4,Maximum Games,HB Studios,,,,0.0,0.06,0.05,,,0.01,2016.0,27th Jun 18,http://www.vgchartz.com/game/120421/mark-mcmorris-infinite-air/?region=All,1,,/games/boxart/full_88187AmericaFrontccc.jpg,0.06, 
14235,Miami Vice: The Game,miami-vice-the-game,Shooter,M,PSP,Vivendi Games,Rebellion Developments,,,,0.0,0.06,0.06,0.0,,0.0,2006.0,,http://www.vgchartz.com/game/1346/miami-vice-the-game/?region=All,1,,/games/boxart/8134310ccc.jpg,0.06,"In Miami Vice The Game, players follow a storyline set just before the events of the film. Gamers must build up the nefarious reputation necessary to infiltrate the seedy underbelly of South Beach, and ultimately bring down the organization of an ""untouchable"" South American drug lord. Gamers can also choose to play as either Crockett or Tubbs, or team up via wireless to play each mission cooperatively. Features

THE MIAMI VICE EXPERIENCEPlay as undercover cops Crockett and Tubbs in the notorious world of Miami Vice - the mansions, the money, and the mayhem - set in present-day Miami
DESIGNED EXCLUSIVELY FOR THE PSP SYSTEMExperience cutting-edge motion capture, highly-detailed environments, and lighting effects inspired by the film created to maximize the technology of the PSP system
COOPERATIVE PLAYPlay as partners with wireless action
Drug TradingRaise needed capital and build reputation by managing drug inventory
HackingUnlock sensitive information (security codes, locations, etc.)
Interactive Cutscene Encounters (ICE)
Continue to boost reputation through dramatic interactive cinematic encounters with powerful drug lords
REPUTATION BUILDING DYNAMICEstablish rep as a major player in the narcotics world through contraband trading, aggressively interacting with drug barons, and pursuing criminals with reckless abandon
HIGH-POWERED ACTION MISSIONSArmed with intelligence from informants and utilizing hacking skills, take on the enemy in varied locations with an impressive array of weapons
BOAT GUNPLAYExperience high-speed chases through Miami's treacherous waterways while engaging in boat-to-boat shootouts
 "
14236,Kamen Rider: Dragon Knight,kamen-rider-dragon-knight,Fighting,T,Wii,D3 Publisher,Eighting,,,,0.0,0.06,0.06,,,0.0,2009.0,,http://www.vgchartz.com/game/41086/kamen-rider-dragon-knight/?region=All,1,,/games/boxart/full_1052342AmericaFrontccc.jpg,0.06,"Based on the new TheCW4Kids live action TV series, the Kamen Rider: Dragon Knight videogame is an intense action packed hero game where players will have the opportunity to experience the exciting Kamen Rider adventure firsthand. Players will be able to play as all 13 Kamen Riders, each with their own unique Advent Cards and special abilities in multiple game modes allowing the players to battle head-to-head or fight legions of enemies as they explore Ventara and stop the menacing plot of General Xaviax. "
14237,Nights of Azure 2: Bride of the New Moon,nights-of-azure-2-bride-of-the-new-moon,Action,T,NS,Tecmo Koei,Gust,,,,0.0,0.06,0.02,0.02,0.01,0.0,2017.0,06th Sep 18,http://www.vgchartz.com/game/185578/nights-of-azure-2-bride-of-the-new-moon/?region=All,1,,/games/boxart/full_9174690AmericaFrontccc.jpg,0.06,"Nights of Azure 2: Bride of the New Moon is a gothic fairy tale action RPG set in a fictional, demon-ridden Western European city towards the end of the 19th century. The story focuses on a knight protector named Aluche and her two childhood friends – Liliana, a kind-hearted priestess, and Ruenheid, a holy knight of the Lourdes Order. While guarding Liliana, Aluche is ambushed and killed only to later awaken as an artificial half-demon at the hands of the New Curia, a religious organization with dark ties.
 In the company of a variety of unlikely allies with their own pasts and agendas, Aluche’s strong desire to save Liliana gives her the strength to scatter the shadows shrouding the world and the motivation to uncover the shocking truth behind the mysterious Queen of the Moon.
Publisher "
14238,BMX XXX,bmx-xxx,Sports,M,GC,Acclaim Entertainment,"Z-Axis, Ltd.",,,,0.0,0.06,0.05,0.01,,0.0,2002.0,,http://www.vgchartz.com/game/4892/bmx-xxx/?region=All,1,,/games/boxart/895235ccc.jpg,0.06,"BMX XXX takes the sport back to where it all began...on the street, in the street and all over the street. It's harder, it's faster and it's got XXX rated game-play written all over it. With hookers, pimps, wackos and dogs in heat, if you want Hardcore, look no further!Live strip sequences - taken from Scores lap dancing club in the U.S. The more coin you collect, the more you get to see!9 huge levels focused on 5 BMX disciplines: Vert, Dirt, Flatland, Park and Real street riding.Create-a-rider - BMX's state of the art create-a-rider empowers you to build virtually any type of male and female, from to toe...you can even cross-dress!*Acclaim - back of box "
14239,Disney's Magical Quest 2 Starring Mickey and Minnie,disneys-magical-quest-2-starring-mickey-and-minnie,Action,E,GBA,Capcom,Capcom,,5.6,,0.0,0.06,0.05,0.02,,0.0,2003.0,,http://www.vgchartz.com/game/26749/disneys-magical-quest-2-starring-mickey-and-minnie/?region=All,1,,/games/boxart/7413595ccc.jpg,0.06,"Play as either Mickey or Minnie in an adventure to stop the Evil Baron Pete from causing trouble. He and his henchmen, the Three Weasel Brothers, have ruined the circus and seized the house of Mickey's old friend the Lonely Ghost. It's up to Mickey and Minnie to stop the madness and save the planet from Baron Pete and his monstrous plans.

Two Playable Characters - users can play as either Mickey or Minnie from the start of the game.
Three different cosutmes to wear, each with custom abilities: Ranger, Cowboy/girl and the sweeper.
Multiplayer Option - Utilize the Game Link cable for multiplayer action!
Meet favorite Disney characters Donald and Goofy who are there to help.

[Capcom] "
14240,The Amazing Spider-Man 2 (2014),the-amazing-spider-man-2-2014,Action-Adventure,E10,3DS,Activision,High Voltage Software,,,,0.0,0.06,0.03,0.03,,0.01,2014.0,19th Mar 18,http://www.vgchartz.com/game/78445/the-amazing-spider-man-2-2014/?region=All,1,,/games/boxart/full_6093689AmericaFrontccc.jpg,0.06,"The Amazing Spider-Man 2 takes place alongside the events of the  second film in a unique story as Spider-Man searches for Uncle Ben’s  killer. You’ll encounter both new foes and old friends as you discover a  larger threat to New York City. Fan-favorite Marvel characters are  woven together with movie villains in a twisted web of  adrenaline-fueled, free-roaming, web-slinging action!
GAME FEATURES:

New Heroism System: ”Hero or Menace” system rewards you for acting  as Spider-Man by stopping crime and saving citizens, but face the  consequences if you don’t keep down crime rates.
Play as Peter Parker: Play as Spider-Man’s citizen alter-ego persona  as you investigate the motivations of multifaceted villains.
All-Star Villain Cast: Wide cast of Spider-Man universe and movie villains, each with their own unique boss battle encounters.
Advanced Combat & Upgrades: New abilities and expanded  fast-paced, acrobatic combat moves bring players up close and personal  as Spidey takes down foes.
All New Web Arsenal: New web-swing mechanic includes expanded  web-shooter capabilities and chemical properties that allow you to  freeze and blow up items on impact.

Source: Publisher "
14241,Aggressive Inline,aggressive-inline,Sports,T,XB,Acclaim Entertainment,"Z-Axis, Ltd.",,9.0,,0.0,0.06,0.05,0.01,,0.0,2002.0,,http://www.vgchartz.com/game/41/aggressive-inline/?region=All,1,,/games/boxart/8231252ccc.jpg,0.06,"The skin on your knees can always grow back. After a while, a fractured nose only looks funny at certain angles. Some people think it's funny when you write backwards that you write ""open head my cracked I."" It doesn't matter what you hurt and what you break in the process--so long as you always go aggressive.

 NEVER STOP PUSHING: The makers of DAVE MIRRA FREESTYLE BMX turn it out again with a skating game showing off fresh new gameplay and twice the polygons of MIRRA.9 HUGE LEVELS: A plethora of rails, ramps, pipes and surprises are await your inlines.
 OVER-THE-TOP TRICKS: Hand grinds, six types of manuals, grind transitions, double leg grind, new big air tricks, wall taps, stalls, wall flips, hand plants and much more never before seen in an extreme sports game.
 INTRODUCING THE ""ACTION BUTTON"": The one button for all your skitching, pole grabbing, vaulting and interactive needs.30 TO 60 OBJECTIVES PER LEVEL: Challenges include time limit point total, Head-to-Head, single trick point value, NPC challenges and many others.
 10 TO 15 CINEMATIC EVENTS PER LEVEL: Special events make the worlds really come alive. As an example, if you skate off of the Atlas statue, the massive globe rolls on to the street smashing two buses that form into a half pipe.
 INTEGRATED PARK EDITOR WITHIN MAIN GAME LEVELS: Allows players to build terrain in order to accomplish objectives.

Playstation "
14242,Smart Boy's Toys Club,smart-boys-toys-club,Misc,E,DS,UFO Interactive,Starfish Inc.,,,,0.0,0.06,0.06,0.0,,0.0,2008.0,,http://www.vgchartz.com/game/27991/smart-boys-toys-club/?region=All,1,,/games/boxart/full_15564AmericaFrontccc.jpg,0.06,"THE  AWARD WINNING SERIES IS BACK AND BETTER THAN EVER!  The first and only developmentally appropriate game for the Nintendo DS just got better! Filled with a nice mix of fun, creativity, and skill building games, this wholesome title is a must have for the youngest gamer! It’s like carrying around a theme park inside your pocket, which the whole family can enjoy! Smart Boy's Toys Club Key Features: 


Fun for Boys – An assortment of  mini-games specifically designed with young boys in mind. 
Wholesome, Skill Building Mini-Games – With 18 mini-games that bring out your child’s creativity and talents, this title will keep your little one occupied for hours. 
Entry Point/Age Appropriate – Perfectly designed with the youngest gamers in mind, our title delivers on providing a fun, safe and creative environment that parents, aunts, uncles and grandparents will approve of. This title is a safe bet for introducing them into the pastime of playing games. 
Ease of Use with the DS – Using the unique features of the DS, your child can interact with the games using the stylus or their fingers, actively engaging and incorporating them into the world of learning and fun. 


Publisher Website "
14243,Ikki Tousen: Xross Impact,ikki-tousen-xross-impact,Action,,PSP,Marvelous Interactive,Marvelous Interactive,,,,0.0,0.06,,,0.06,,2010.0,,http://www.vgchartz.com/game/40642/ikki-tousen-xross-impact/?region=All,1,,/games/boxart/full_2824693JapanFrontccc.jpg,0.06,"Ikki Tousen: Xross Impact is a Beat-'Em-Up game, developed and published by Marvelous,  which was released in Japan in 2010. "
14244,Dead or Alive Xtreme 3: Fortune,dead-or-alive-xtreme-3-fortune,Sports,,PS4,Tecmo Koei,Team Ninja,,,,0.0,0.06,,,0.06,,2016.0,,http://www.vgchartz.com/game/85842/dead-or-alive-xtreme-3-fortune/?region=All,1,,/games/boxart/full_8007508JapanFrontccc.jpg,0.06, 
14245,Jewels of the Ages,jewels-of-the-ages,Puzzle,E,DS,City Interactive,City Interactive,,,,0.0,0.06,0.03,0.02,,0.01,2011.0,,http://www.vgchartz.com/game/51915/jewels-of-the-ages/?region=All,1,,/games/boxart/full_jewels-of-the-ages_392AmericaFront.jpg,0.06, 
14246,Cold Stone Creamery: Scoop It Up,cold-stone-creamery-scoop-it-up,Misc,E,Wii,Zoo Games,Zoo Games,,,,0.0,0.06,0.06,,,0.0,2009.0,,http://www.vgchartz.com/game/41220/cold-stone-creamery-scoop-it-up/?region=All,1,,/games/boxart/full_2683023AmericaFrontccc.jpg,0.06, 
14247,Super Mahjong 2: Honkaku 4Jin Uchi,super-mahjong-2-honkaku-4jin-uchi,Misc,,SNES,Imax,I'Max,,,,0.0,0.06,,,0.06,0.0,1993.0,,http://www.vgchartz.com/game/4427/super-mahjong-2-honkaku-4jin-uchi/?region=All,1,,/games/boxart/full_super-mah-jong-2_733JapanFront.jpg,0.06, 
14248,XGRA: Extreme G Racing Association,xgra-extreme-g-racing-association,Racing,T,PS2,Acclaim Entertainment,Acclaim Studios Cheltenham,,,,0.0,0.06,0.03,0.02,,0.01,2003.0,,http://www.vgchartz.com/game/6030/xgra-extreme-g-racing-association/?region=All,1,,/games/boxart/full_7709037AmericaFrontccc.jpg,0.06,"The next step in the continued evolution of the critically-acclaimed Extreme-G Racing brand, with sales of over one million units in the US alone, XGRA: Extreme-G Racing Associationbrings to life the motor sport of the future. All of the speed and excitement of the series is intact, with a host of new race types, mission objectives and unlockable content that will firmly place XGRA at the pole position.
Features

SiNN (Sports Interactive News Network) and the XGRA (Extreme Gravity Racing Association) create a future motor sport unlike anything ever experienced.
8 different teams, all with unique histories, sponsors, and rivalries
Variable missions and storylines that make each race part of a larger career.
A game structure designed to emulate a true motor sport season with various classes and race types.
A variety of different and completely tweakable main vehicle types.
A wide range of characters, each with skills & statistics that affect how they race.
A rewards system that allows for a slew of unlockable content--from game modes to new tracks, from faster bikes to character-enhancing cybernetic implants.
Environments that bring worlds to life. From variable weather systems to realistically constructed buildings, all 16 tracks are set in worlds so startling, you may actually forget to race.
An interactive HUD that not only provides all relevant information during the race, but can be manipulated during gameplay.
Destructible objects--from gas pipes to bridges to spectators, the track can be changed dynamically by anyone throughout the race.
A new weapons system that allows the player to easily select and use weapons without fear of losing focus on the race.

 "
14249,Mitsukete! Keroro Gunsou: Machigai Sagashi Daisakusen de Arimasu!,mitsukete-keroro-gunsou-machigai-sagashi-daisakusen-de-arimasu,Action,,DS,Namco Bandai,Bandai Namco Games,,,,0.0,0.06,,,0.06,,2007.0,,http://www.vgchartz.com/game/3581/mitsukete-keroro-gunsou-machigai-sagashi-daisakusen-de-arimasu/?region=All,1,,/games/boxart/full_6915272JapanFrontccc.jpg,0.06, 
