Rank,Name,basename,Genre,ESRB_Rating,Platform,Publisher,Developer,VGChartz_Score,Critic_Score,User_Score,Total_Shipped,Global_Sales,NA_Sales,PAL_Sales,JP_Sales,Other_Sales,Year,Last_Update,url,status,Vgchartzscore,img_url,Global_Total,Summary
9740,Mega Man Network Transmission,mega-man-network-transmission,Platform,E,GC,Capcom,Arika,,,,0.0,0.17,0.13,0.03,,0.0,2003.0,,http://www.vgchartz.com/game/1304/mega-man-network-transmission/?region=All,1,,/games/boxart/2145910ccc.jpg,0.17,"OKAY, LISTEN UP PARTNER.
A month has passed since the evil WWW organisation attempted to commandeer a military satellite. Now cyberspace is about to encounter another menace, the devastating Zero Virus. So it's up to you, Lan and Megaman to defeat this latest threat, battle bosses and help solve problems in the virtual realm.
GO TO WORK!

First ever Megaman game for the NINTENDO GAMECUBE.
Players can select and arrange Battle Chips as they wish to perform over 100 different customised attacks.
Wide variety of playing styles.
Exciting new storyline - learn what happened in between Megaman Battle Network and Megaman Battle Network 2.

*Back of Box (PAL) "
9741,BoneBone: Rise of the Deathlord,bonebone-rise-of-the-deathlord,Strategy,,PC,Unknown,Vladis Fire,,,,0.17,0.0,,,,,2003.0,13th Mar 19,http://www.vgchartz.com/game/223845/bonebone-rise-of-the-deathlord/?region=All,1,,/games/boxart/full_735374AmericaFrontccc.jpg,0.17, 
9742,Pursuit Force,pursuit-force,Racing,T,PSP,Sony Computer Entertainment,Bigbig Studios,,7.4,,0.0,0.17,0.14,0.01,,0.02,2006.0,,http://www.vgchartz.com/game/1814/pursuit-force/?region=All,1,,/games/boxart/full_6069577AmericaFrontccc.jpg,0.17,"Pursuit Force is a video game made exclusively for the PlayStation Portable which puts the player in the role of a tough cop who joins up to a new elite police unit to restore order to a city overrun with gangs. This elite unit, known as the Pursuit Force, specialises in direct armed encounters with adversaries, whether it be on foot or on the bonnet of a speeding car. The player has to try to seize cars and motorbikes whilst engaging in gun battles at speeds of over 150mph. It is set in fictional Capital State (which includes Capital City) in America where there are various criminal gangs to contend with.  "
9743,Densetsu no Stafi 4,densetsu-no-stafi-4,Platform,,DS,Nintendo,TOSE,,,,0.0,0.17,,,0.17,,2006.0,,http://www.vgchartz.com/game/3651/densetsu-no-stafi-4/?region=All,1,,/games/boxart/full_6452580JapanFrontccc.jpg,0.17, 
9744,TRON: Evolution,tron-evolution,Action,E10,DS,Disney Interactive Studios,n-Space,,,,0.0,0.17,0.11,0.04,,0.01,2010.0,,http://www.vgchartz.com/game/47062/tron-evolution/?region=All,1,,/games/boxart/full_tron-evolution_738AmericaFront.jpg,0.17,"TRON: Evolution DS is an exciting action / adventure game that casts you in the story as a System Monitor investigating a power failure crisis that threatens the entire grid. Players can take on the puzzle-centric Story Mode or the action-packed Grid Games, featuring Light Cycles, Tanks, Recognizers, and Disc Combat. Grid Games support up to 4 players locally with both competitive and cooperative modes. "
9745,Shin Megami Tensei: Devil Summoner 2 - Raidou Kuzunoha vs. King Abaddon (JP sales),shin-megami-tensei-devil-summoner-2-raidou-kuzunoha-vs-king-abaddon-jp-sales,Role-Playing,M,PS2,Atlus,Atlus Co.,,,,0.0,0.17,,,0.17,,2009.0,,http://www.vgchartz.com/game/28285/shin-megami-tensei-devil-summoner-2-raidou-kuzunoha-vs-king-abaddon-jp-sales/?region=All,1,,/games/boxart/full_5104788AmericaFrontccc.jpg,0.17,"A new threat to Japan's Capital calls for the return of its case-solving, tube-slinging Devil Summoner: Raidou Kuzunoha the 14th. When a woman walks into the Narumi Detective Agency and asks to find a man, Raidou's boss is reluctant to accept, but soon it's clear there's more to the case than it seems on the surface. It isn't long before Raidou is on the trail of crooked gamblers, masked ninja, and strange insects... a trail leading him inexorably to the mysterious King Abaddon.Features

Massively upgraded battle systemAdvancements to the battle mechanics include a MAG balancing system, dodge and hide abilities, and the ability to command two demons in combat. Use the retooled Weapon Alchemy system to create new swords with unique special attacks.
Deeper demon integrationDemon negotiation returns with more than twice the number of demons to attempt to recruit to your side. Create more powerful demons through fusion and skill transfer. Control two demons in battle and choose from more tactical options.
Phenomenal creative teamThe rich environment of this Taisho-era Japan comes to life with the character designs of Kazuma Kaneko and the musical score of Shoji Meguro.Over 500 character possibilities - 10 races, 2 genders, 3 alignments, and 15 majors add up to incredible opportunity to customize your party! Change majors for further customization at higher levels.
 "
9746,Dishonored: Death of the Outsider,dishonored-death-of-the-outsider,Action,M,PC,Bethesda Softworks,Arkane Studios,,,,0.17,0.0,,,,,2017.0,03rd Mar 18,http://www.vgchartz.com/game/182728/dishonored-death-of-the-outsider/?region=All,1,,/games/boxart/full_8753087AmericaFrontccc.jpg,0.17,"THE GREATEST ASSASSINATION EVER.
From the award-winning developers at Arkane Studios comes Dishonored®: Death of the Outsider, the first standalone adventure in the critically-acclaimed Dishonored series.
Be a badass supernatural assassin and take on the role of notorious Billie Lurk as she reunites with her mentor Daud in order to pull off the greatest assassination ever conceived.
To complete your mission you’ll have to journey deep into the seedy underbelly of Karnaca, where you’ll unravel some the city’s darkest secrets.
Along the way you’ll infiltrate underground fight clubs and black magic cults, and retrieve ancient artifacts in a thrilling bank heist mission that sets the table for your greatest mission ever.
Official Website. "
9747,Tribal Pass,tribal-pass,Action,,PC,Unknown,Tribe Tea,,,,0.17,0.0,,,,,2017.0,13th Mar 19,http://www.vgchartz.com/game/223846/tribal-pass/?region=All,1,,/games/boxart/full_6182992AmericaFrontccc.jpg,0.17, 
9748,TT Isle of Man: Ride on the Edge,tt-isle-of-man-ride-on-the-edge,Racing,E,PS4,Big Ben Interactive,Kylotonn,,,,0.0,0.17,0.05,0.09,,0.03,2018.0,07th Mar 18,http://www.vgchartz.com/game/221258/tt-isle-of-man-ride-on-the-edge/?region=All,1,,/games/boxart/full_6748862AmericaFrontccc.jpg,0.17, 
9749,Bomberman Land,bomberman-land,Misc,E,Wii,Hudson Soft,Hudson Soft,,6.0,,0.0,0.17,0.11,0.02,0.03,0.01,2008.0,,http://www.vgchartz.com/game/15990/bomberman-land/?region=All,1,,/games/boxart/9186525ccc.jpg,0.17,"Prepare for an all new adventure game, the likes of which the Wii™ has never seen before!  Bomberman Land for the Wii™ is jam-packed with three games in one!  Play through the Story Mode and save Bomberman Land from the evil Champion Bomber, party on in Attraction Mode with over 50 mini-games, or battle head-to-head-to-head-to-head (up to 4 players!) in Battle Mode on classic Bomberman battle maps!!  It's coming soon, so keep checking back for more information!
 
In Story Mode, help Cheerful White on a quest to become the champion of Bomberman Land, and overthrow the mean and spoiled current Champion!  Travel through 5 zones as you take on various mini-games and collect special pieces that aid you in your quest.  The only way to play mini-games is to collect coins though, so look carefully, play wisely, and don't give up without a fight!

Hudson "
9750,Surf's Up,surfs-up,Sports,E10,Wii,Ubisoft,Ubisoft Montreal,,,,0.0,0.17,0.15,0.0,,0.01,2007.0,,http://www.vgchartz.com/game/6136/surfs-up/?region=All,1,,/games/boxart/3475088ccc.jpg,0.17,"Surf's Up is an exciting arcade surfing and extreme sports video game. The action is set at the annual ""Reggie Belafonte Big Z Memorial Surf Off,"" where surfers from around the world are ready to risk it all for glory. Players will experience the rush and thrills of surfing in exotic surf spots around Pen Gu Island, and can rip it up as one of 10 characters from the film, such as Cody, the young challenger from Shiverpool; Tank, the merciless champion; or Z, the surfing legend from the past. Only by mastering and understanding the waves can the player become not only the new champion, but a true surf legend.Game Features
 

Innovative arcade and surf feeling with players performing a variety of impressive tricks in the air and learning to surf inside a tube. 
Win the championship in the single-player mode or challenge your friends in the multiplayer mode with easy pick-up-and-play game controls.  
10 playable characters with their own tricks and characteristics. 
Impressive water simulation and physics. Surf in a variety of locations, each with its own waves and obstacles. Train in the calm water of Shiverpool, ride your first tubes in Pen Gu Island and try to surf on the explosive waters of the volcano area 
Tons of unlockable content. 
Awesome game soundtrack for carving waves featuring more than 20 licensed music tracks.
 "
9751,Tokimeki Memorial: Private Collection,tokimeki-memorial-private-collection,Misc,,PS,Konami,Konami,,,,0.0,0.17,,,0.16,0.01,1996.0,,http://www.vgchartz.com/game/4602/tokimeki-memorial-private-collection/?region=All,1,,/games/boxart/full_5805748JapanFrontccc.jpg,0.17, 
9752,Axiom Verge,axiom-verge,Action,E10,NS,Thomas Happ Games,Thomas Happ Games,,7.5,,0.0,0.17,0.12,0.03,,0.02,2017.0,12th Jan 18,http://www.vgchartz.com/game/190934/axiom-verge/?region=All,1,,/games/boxart/full_3567213AmericaFrontccc.jpg,0.17,"A failed scientist dies in an accident, only to awaken in a mysterious, alien world.
Where is he? How did he get here? And why do the fundamental laws of reality appear broken?
Life. Afterlife. Real. Virtual. Dream. Nightmare. It's a thin line.
It's Axiom Verge.
Source: Official site "
9753,NBA Street Homecourt,nba-street-homecourt,Sports,E,PS3,Electronic Arts,EA Canada,,,,0.0,0.17,0.13,0.01,0.0,0.02,2007.0,,http://www.vgchartz.com/game/3902/nba-street-homecourt/?region=All,1,,/games/boxart/8047208ccc.jpg,0.17,"
Take to the streets, defend your homecourt, and showcase every move on your way to becoming a NEXT GEN hometown legend in NBA STREET Homecourt. Use an all-new ball control system to blow past defenders or rattle the rim with high-lying Jump-Off dunks as you defend your homecourt against the best the NBA has to offer.   With new Gamebreaker battles and the revolutionary Trick Remixer that allows you to shake, juke, and leap past anyone foolish enough to get in your way, your legendary status awaits you in NBA STREET Homecourt
 
Source - www.electronicarts.co.uk
 "
9754,RC Revenge Pro,rc-revenge-pro,Racing,E,PS2,Acclaim Entertainment,Acclaim Entertainment,,,,0.0,0.17,0.08,0.06,,0.02,2001.0,09th May 18,http://www.vgchartz.com/game/30993/rc-revenge-pro/?region=All,1,,/games/boxart/full_3572030AmericaFrontccc.jpg,0.17,"Grab the controls and hold on for dear life with the most electrifying, high-speed racing experience available.Race and wreck in enchanting movie-theme worlds, kick it into overdrive with over 30 super-flying vehicles, and blow away the competition with outrageous weapons in the most electrifying racing experience available!Previously known as Revolt 2: Pocket Rockets, this RC vehicle racer graces the 128-bit system with all the slick track designs, great weapons balance, and dead-on control that made the PC and Dreamcast versions such a hit. Luckily, developers from Acclaim's Cheltenham Studios have taken full advantage of the PlayStatation 2 hardware--no longer will tracks be confined to suburban neighborhoods and museums. RC Revenge goes all out to deliver the goods with environments like desert islands and villages wrapped nighttime slumber. And the best part of it all? A level editor for the creative gamer is set to keep the replay value on high.
us.playstation.com "
9755,Journey,journey,Adventure,E,PSN,Sony Computer Entertainment America,thatgamecompany,,,,0.0,0.17,0.04,0.11,,0.01,2012.0,23rd Sep 18,http://www.vgchartz.com/game/45780/journey/?region=All,1,,/games/boxart/full_7495098AmericaFrontccc.jpeg,0.17,"Explore the ancient, mysterious world of Journey™ as you soar above ruins and glide across sands to discover its secrets. Play alone or in the company of a fellow traveler and explore its vast world together. Featuring stunning visuals and a Grammy-nominated musical score, Journey™ delivers a breathtaking experience like no other.
Source: us.playstation.com "
9756,Chaotic: Shadow Warriors,chaotic-shadow-warriors,Action,E10,PS3,Activision,Activision,,,,0.0,0.17,0.15,,,0.02,2009.0,,http://www.vgchartz.com/game/38751/chaotic-shadow-warriors/?region=All,1,,/games/boxart/full_8967578AmericaFrontccc.jpg,0.17,"Based on the popular trading card game and animated television series, Chaotic combines action, role playing and turn-based strategy gameplay elements for an epic adventure in Perim, the stunning Chaotic world. Players adventure through vibrant, fully-realized 3D environments and interact with various characters from the best-selling trading card game and hit animated series. Players will build and manage their own army of Chaotic creatures while fighting enemies, collecting battlegear and unlocking new mugic (magic) spells and attacks. The Chaotic videogame features dramatic tactical battles, a variety of captivating gameplay modes, as well as powerful upgrades and valuable unlockables. "
9757,Dementium: The Ward,dementium-the-ward,Shooter,M,DS,Gamecock,Renegade Kid,,7.5,,0.0,0.17,0.15,0.01,,0.01,2007.0,,http://www.vgchartz.com/game/12467/dementium-the-ward/?region=All,1,,/games/boxart/7175171ccc.jpg,0.17,"Dementium: The Ward combines action-adventure, first-person shooter and survival horror into one nightmarish experience. Pushing the limits of the Nintendo DS with full 3D visuals, this ""next generation"" title will set the bar for mature handheld games.  Dementium tells the tale of a man who awakens to find himself alone, with no memories of his past, in a mysterious, derelict hospital that is frozen in time. Confronted by the deadly, grotesque surgical experiments that wander the halls, a series of challenging puzzles and a cast of peculiar characters, he must face his deepest fears, unlock the mysteries of the hospital, and escape with his life. A completely new experience on the Nintendo DS, Dementium promises to creep you out with gory visuals and bone-chilling audio that brings the world screaming to life. Gamecock Media Group "
9758,Backyard Wrestling: Don't Try This at Home,backyard-wrestling-dont-try-this-at-home,Fighting,M,XB,Eidos Interactive,Paradox Development,,6.0,,0.0,0.17,0.13,0.04,,0.01,2003.0,,http://www.vgchartz.com/game/148/backyard-wrestling-dont-try-this-at-home/?region=All,1,,/games/boxart/5977536ccc.jpg,0.17,"Get ready for the most hardcore fighting experience on your console. Insane stunts, brutal weapons and a whole world of pain, Backyand Wrestling allows you to step into a groundbreaking new world of open-ended gameplay.
Punish your opponent using instruments of pain like bricks, light bulbs, tables as well as the environment itself. "
9759,Gauntlet: Dark Legacy,gauntlet-dark-legacy,Action,T,XB,Midway Games,Midway Games West,,,,0.0,0.17,0.13,0.04,,0.01,2002.0,,http://www.vgchartz.com/game/5150/gauntlet-dark-legacy/?region=All,1,,/games/boxart/2689969ccc.jpg,0.17,"Gauntlet Dark Legacy: The game where you and 3 buddies all get to be heroes. Only thing is, one of you has to be the chick. Alone or with up to 3 of your friends, embark on a quest to collect the mythic 13 rune stones and battle the evil wizard Garm. Hack and slash your way through the Forsaken Province, Warrior King's Mountain Realm, Dwarves'Ice Caves and many more.
 
Xbox.com "
9760,Far East of Eden II: Manji Maru,far-east-of-eden-ii-manji-maru,Role-Playing,,PS2,Hudson Soft,Hudson Soft,,,,0.0,0.17,,,0.17,,2003.0,,http://www.vgchartz.com/game/3279/far-east-of-eden-ii-manji-maru/?region=All,1,,/games/boxart/full_6206451JapanFrontccc.jpg,0.17, 
9761,Lost Kingdoms,lost-kingdoms,Role-Playing,T,GC,Activision,From Software,,7.3,,0.0,0.17,0.1,0.02,0.04,0.0,2002.0,,http://www.vgchartz.com/game/4206/lost-kingdoms/?region=All,1,,/games/boxart/full_624525AmericaFrontccc.jpg,0.17, 
9762,Naval Assault: The Killing Tide,naval-assault-the-killing-tide,Simulation,T,X360,505 Games,Artech Studios,,,,0.0,0.17,0.08,0.07,,0.02,2010.0,,http://www.vgchartz.com/game/44957/naval-assault-the-killing-tide/?region=All,1,,/games/boxart/full_6394238AmericaFrontccc.jpg,0.17,"Getting underway from New York harbor, Naval Assault: The Killing Tide tells the story of the Allied submariner effort against Axis forces across the key naval warzones of World War II. Players will captain an arsenal of faithfully recreated U.S. Naval submarines against enemy warship assaults both above and below the water's surface. In Naval Assault: The Killing Tide, players will need a healthy dose of stealth and cunning as well as sharp-shooting deck gun and torpedo skills to successfully destroy the enemy fleets in the 30 missions throughout the game. "
9763,I'm A Celebrity: Get Me Out of Here!,im-a-celebrity-get-me-out-of-here,Misc,,Wii,Mindscape,Mindscape,,,,0.0,0.17,,0.16,,0.01,2009.0,,http://www.vgchartz.com/game/40393/im-a-celebrity-get-me-out-of-here/?region=All,1,,/games/boxart/full_1985423PALFrontccc.jpg,0.17,"I'm A Celebrity... Get Me Out of Here! is a Trivia / Game Show game, developed and published by Mindscape Inc.,  which was released in Europe in 2009. "
9764,F1 2018,f1-2018,Racing,E,XOne,Codemasters,Codemasters Birmingham,,,,0.0,0.17,0.05,0.1,,0.01,2018.0,26th Sep 18,http://www.vgchartz.com/game/222005/f1-2018/?region=All,1,,/games/boxart/full_5196140AmericaFrontccc.jpg,0.17,"
MAKE HEADLINES IN F1™ 2018
GREATER CAREER DEPTH, MORE CLASSIC CARS AND RELEASE DATE CONFIRMED
F1™ 2018, the official videogame of the 2018 FIA FORMULA ONE WORLD  CHAMPIONSHIP™, immerses players into the world of Formula 1® more than  ever before. F1 2018 released onto PlayStation®4 computer entertainment  system, the Xbox One family of devices including the Xbox One X and  Windows PC (DVD and via Steam) worldwide on Friday 24th August 2018, the  weekend of the FORMULA 1 2018 BELGIAN GRAND PRIX at the iconic  Spa-Francorchamps Circuit.
“We were delighted by the reception that the highly-acclaimed F1 2017  game received, and are extremely excited to be able to further build on  such a strong starting point with F1 2018” said Paul Jeal, F1 Franchise  Director at Codemasters. “Over the past few years we have engaged  heavily with our fan-base to understand what is important to them, and  we cannot wait to unveil more details on features we know our fans will  love. Career mode has been further expanded to immerse players even  deeper into the world of F1 than before, with the return of a highly  requested feature back into the franchise. We are also adding more  classic cars, again listening to our fans as to which of the historical  F1 cars they would most like to virtually drive next. Outside of those  headline additions there are many other great enhancements to be  revealed before the game launches.”
Source: http://www.codemasters.com/game/f1-2018/
 "
9765,NCAA Basketball 09,ncaa-basketball-09,Sports,E,PS3,EA Sports,EA Canada,,,,0.0,0.17,0.15,,,0.01,2008.0,,http://www.vgchartz.com/game/26768/ncaa-basketball-09/?region=All,1,,/games/boxart/full_9688663AmericaFrontccc.jpg,0.17,"NCAA Basketball 09 operates on a new gameplay engine with over 1,000 new animation sequences that deliver a more responsive experience with improved ball physics and more intelligent AI. The new animation system enables gamers to apply pressure defense with new full-court presses and traps. Plus, improved AI and animations enable quicker players to get up and down the floor faster and make better decisions running the lanes and driving to the rim. Animations can be interrupted at any time, enabling you to read and respond to the action on the floor, just like real life. Feel the excitement of game night with the band playing fight songs, the student section leading the cheers and popular ESPN college basketball broadcasters Dick Vitale, Brad Nessler, and Erin Andrews providing the commentary.
Playstation "
9766,Last Tale,last-tale,Action,,PC,Unknown,YarGri,,,,0.17,0.0,,,,,2008.0,16th Mar 19,http://www.vgchartz.com/game/223861/last-tale/?region=All,1,,/games/boxart/full_3438697AmericaFrontccc.jpg,0.17, 
9767,Matchbox Cross Town Heroes,matchbox-cross-town-heroes,Racing,E,GBA,THQ,Magellan Interactive,,,,0.0,0.17,0.12,0.04,,0.0,2002.0,,http://www.vgchartz.com/game/27463/matchbox-cross-town-heroes/?region=All,1,,/games/boxart/full_5431890AmericaFrontccc.jpg,0.17,"In Matchbox Cross Town Heroes, young game players will take the wheel of popular Matchbox vehicles like the Fire Crusher or Rescue Net Police Car in three extensive worlds.  Players can drive and explore amazing interactive environments to search for new emergencies.  Every time a new world is visited, the location of the emergency tasks will be different, allowing for endless replay.  Each world will also feature bonus mini games and puzzles along with more than 50 different characters, animals and creatures.  Upon completing emergency tasks, players will earn hero awards allowing them to unlock new vehicles and earn printable certificates of heroic achievement. "
9768,Age of Empires III: Complete Collection,age-of-empires-iii-complete-collection,Strategy,T,PC,Microsoft Game Studios,Ensemble Studios,,,,0.0,0.17,0.01,0.13,,0.03,2009.0,,http://www.vgchartz.com/game/48681/age-of-empires-iii-complete-collection/?region=All,1,,/games/boxart/full_age-of-empires-iii-complete-collection_175AmericaFront.jpg,0.17, 
9769,Wolfenstein 3D,wolfenstein-3d,Shooter,M,GBA,BAM! Entertainment,Stalker Entertainment,,,,0.0,0.17,0.12,0.04,,0.0,2002.0,,http://www.vgchartz.com/game/15103/wolfenstein-3d/?region=All,1,,/games/boxart/full_4045854AmericaFrontccc.jpg,0.17,"IT BEGAN AS A GAME.  IT CONTINUES AS A LEGEND.
A Nazi stronghold awaits, and only you can smash your way into its hidden depths, blowing away enemy scum as you go.  Ammo up---this is the game the Computer Gaming World Hall of Fame credits as helping shape the computer gaming industry!  Id Software's classic powerhouse is back---and now in the palm of your hand!  Let the carnage begin.
- Armed with serious firepower, you blast deep into the enemy's stronghold.
- Classic gameplay, classic characters, classic action---the original FPS hit.
- Nazis engage you at every turn, defending the castle's ruthless secrets.
(source: back of box) "
9770,Nobunaga no Yabou: Tenshoki,nobunaga-no-yabou-tenshoki,Strategy,,SNES,KOEI,Koei,,,,0.0,0.17,,,0.17,0.0,1996.0,,http://www.vgchartz.com/game/3938/nobunaga-no-yabou-tenshoki/?region=All,1,,/games/boxart/full_6317864JapanFrontccc.jpg,0.17,"Nobunaga no Yabou: Tenshoki is a Strategy game, published by Koei,  which was released in Japan in 1996. "
9771,Angry Birds Trilogy,angry-birds-trilogy,Puzzle,E,PS3,Activision,Rovio Mobile,,,,0.0,0.17,0.12,0.02,,0.03,2012.0,12th Jul 18,http://www.vgchartz.com/game/71488/angry-birds-trilogy/?region=All,1,,/games/boxart/full_4777910AmericaFrontccc.jpg,0.17, 
9772,Learning to Spell,learning-to-spell,Misc,E,DS,505 Games,505 Games,,,,0.0,0.17,0.16,,,0.01,2010.0,,http://www.vgchartz.com/game/43249/learning-to-spell/?region=All,1,,/games/boxart/full_4882528AmericaFrontccc.jpg,0.17,Spelling can be fun! Learn and master over 300 worlds along with fun mini games to develop spelling handwriting reading alphabet and keyboard skills. Hosted by a cool puppy character this game is designed to be entertaining while supporting language development. 
9773,Pac-Man World 3,pac-man-world-3,Platform,E,DS,Namco,Blitz Games,,,,0.0,0.17,0.15,0.0,,0.01,2005.0,,http://www.vgchartz.com/game/5568/pac-man-world-3/?region=All,1,,/games/boxart/full_3380200AmericaFrontccc.jpg,0.17,"
New story puts Pac-Man into a strange new world, leading him to the mysterious Spectral Realm. 
Control the Ghosts! - Special feature now allows players to control Pinky and Clyde 
Store an arsenal of power-ups like the Power Ribbon, Time Decelerator, Electro-Charge, Chrome Power, and Super Butt Bounce...and super-charge them by collecting special fruits! 
Get transported into classic 2D and 3D Pac-Man mazes to compete for bonuses 
New Pac-Man moves - Now you can climb fences, jump up walls, swing around poles and punch enemies! 
Includes the original Pac-Man arcade game from 1980! 

Source - www.namcobandaigames.com (publisher) "
