Rank,Name,basename,Genre,ESRB_Rating,Platform,Publisher,Developer,VGChartz_Score,Critic_Score,User_Score,Total_Shipped,Global_Sales,NA_Sales,PAL_Sales,JP_Sales,Other_Sales,Year,Last_Update,url,status,Vgchartzscore,img_url,Global_Total,Summary
9001,Descent,descent,Shooter,T,PS,Interplay,Parallax Software,,,,0.0,0.19,0.11,0.07,,0.01,1996.0,,http://www.vgchartz.com/game/504/descent/?region=All,1,,/games/boxart/full_9502774AmericaFrontccc.jpg,0.19,"Take control of a craft specially designed to navigate the tight corridors of the mineshafts. Your vehicle is also equipped with guns, missiles, and other weapons you can use to destroy the alien threat. Aliens have invaded the Lunar 1 mining colony, and you are the only person who can prevent them from taking over. Don't miss a single detail of the 27 levels thanks to free 360-degree movement in the fully 3D environments. Do you have the skills to drive out the aliens? Play Descent and find out.  "
9002,Closure,closure,Platform,,PC,Glaiel Games,Glaiel Games,,,,0.19,0.0,,,,,2009.0,,http://www.vgchartz.com/game/38913/closure/?region=All,1,,/games/boxart/full_closure_13AmericaFront.jpg,0.19, 
9003,Rabiez: Epidemic,rabiez-epidemic,Strategy,,PC,Unknown,Sekerin Productions,,,,0.19,0.0,,,,,2009.0,01st Mar 19,http://www.vgchartz.com/game/223756/rabiez-epidemic/?region=All,1,,/games/boxart/full_4451966AmericaFrontccc.jpg,0.19, 
9004,Conflict: Denied Ops,conflict-denied-ops,Shooter,M,X360,Eidos Interactive,Pivotal Games,,5.3,,0.0,0.19,0.08,0.09,,0.02,2008.0,,http://www.vgchartz.com/game/15965/conflict-denied-ops/?region=All,1,,/games/boxart/2169392ccc.jpg,0.19,"Venezuela is left in a state of civil war after the government was brutally overthrown by a military coup. With factions fighting to reinstate democracy, the U.S. government has offered their assistance, though the new government regime has threatened to deploy nuclear weapons if the U.S. meddles in Venezuelan affairs. The threat needs to be neutralized, and the U.S can't risk nuclear war.
The CIA Special Activities Division operates in isolation and secrecy. If captured, any link with the U.S. Government will be denied.
Conflict: Denied Ops is a highly accessible co-op FPS featuring massive, extremely explosive firefights across destructible environments. Work as a team to utilize the specific skills of each operative and experience the ultimate in destructive satisfaction with tons of exploding objects and an endless barrage of terrorists who are begging to be blown to hell.

Features:

Two-Man Tactics - Switch between team members at any time in single-player mode for maximum control, or have a friend join your game online.


Explode Your Enemies – Levels are built around massive fire fights with a continuous stream of enemies, and tons of exploding objects littered around the level to help your cause.


Destroy Everything – Obliterate your enemies with explosions, demolish buildings, blow through walls and destroy almost anything in the environment.


Accessible Action – In single-player mode, give commands to your team mate simply by pressing or holding a single button. Concentrate on the action, not complicated menus or control schemes.


Puncture-Tech™ – Utilize strategic destruction made possible with new Puncture-Tech™ technology developed by Pivotal Studios. Blast open new pathways, shoot unaware enemies through walls, or create holes in your cover to generate firing paths.


Source - www.eidosinteractive.com (publisher)
  "
9005,Enchanted Arms,enchanted-arms,Role-Playing,T,X360,Ubisoft,From Software,,6.9,,0.0,0.19,0.16,0.02,,0.01,2006.0,,http://www.vgchartz.com/game/644/enchanted-arms/?region=All,1,,/games/boxart/4969272ccc.jpg,0.19,"Embark on an epic RPG adventure and escape to a fantasy world filled with beautiful cinematic-quality graphics, unique characters and bizarre creatures. Take the roll of Atsuma, Enchanter-In-Training, and transform from a naïve student to the most powerful savior in a war 1,000 years in the making.
Enchanted Arms takes place in a fantasy world ruled by a powerful called “Enchant.” Humans have learned to use Enchant magic to controls the environment around them. However, lurking behind this newfound peaceful utopia, an unknown force has just awakened a hidden army of ancient creatures.
Immerse yourself in this classic tale of good versus evil as you face increasingly difficult challenges and learn to master Atsuma’s special fighting and magical abilities. Meet new allies and unlock new creatures as your party becomes stronger. You must rely on your skills, magic and allies if you wish to succeed.
Ubi.com
  "
9006,Test Drive Unlimited 2,test-drive-unlimited-2,Racing,T,PC,Atari,Eden Studios,,6.7,,0.0,0.19,0.05,0.11,,0.03,2011.0,,http://www.vgchartz.com/game/43817/test-drive-unlimited-2/?region=All,1,,/games/boxart/full_test-drive-unlimited-2_108AmericaFront.jpg,0.19,"Test Drive Unlimited 2 aims to transform the driving genre, adding the persistency, progression and customization of the latest multiplayer games to the racing experience.  Test Drive Unlimited 2 blends single player and multiplayer sxperiences seamlessly, creating a dynamic world of evolving content and challenges.  Players define their online persona through unparalleled customization of their avatars and vehicles, and the acquisition of property, clothing and other accoutrements of a luxurious international lifestyle.  The challenge comes to life with refinement and balance of the core Test Drive driving experience.  All-new race types, vehicle classes, environmental challenges, locations and much more push this epic franchise to new levels of performance. "
9007,SpongeBob SquigglePants 3D,spongebob-squigglepants-3d,Misc,E,3DS,THQ,WayForward Technologies,,6.1,,0.0,0.19,0.13,0.05,,0.02,2011.0,,http://www.vgchartz.com/game/50236/spongebob-squigglepants-3d/?region=All,1,,/games/boxart/full_spongebob-squigglepants_50AmericaFront.jpg,0.19,"LAUGH YOUR SQUIGGLEPANTS OFF!

Wacky Nanogames  – Tilt, flick, tap and draw through more than 100 Nanogame challenges,  frantically timed for laugh-out-loud and fast-paced excitement
NEW!  Splashin’ SpongeBob Looks  – Never-before-seen SpongeBob art  collections unlocked from the Nickelodeon vault and featured in six zany  worlds
Patchy the Pirate LIVE! – President of SpongeBob’s fan  club, he serves as a guide of the game in a never-before-seen live  action experience adding hilarity and under the sea silliness
Endless  Creativity –  Create, color and draw anything imaginable with custom  paints, palettes, stamps and art tools to create a masterpiece worth of a  place in Patchy's own collection of SpongeBob Art
Exclusive level for 3DS Version!

(THQ) "
9008,South Park: The Stick of Truth,south-park-the-stick-of-truth,Role-Playing,M,PC,Ubisoft,Obsidian Entertainment,,,,0.0,0.19,0.07,0.1,,0.02,2014.0,26th Jan 18,http://www.vgchartz.com/game/71110/south-park-the-stick-of-truth/?region=All,1,,/games/boxart/full_363408AmericaFrontccc.jpeg,0.19,"From the creators of South Park, Trey Parker and Matt Stone, comes an epic quest to become…cool.Arm yourself with weapons of legend to defeat underpants gnomes, hippies, and other forces of evil. Discover the lost Stick of Truth and succeed in earning your place alongside Stan, Kyle, Cartman, and Kenny as their new friend. Fail, and you will forever be known as…a loser.
Source: Ubisoft Store. "
9009,Taiko no Tatsujin: Wii U Version!,taiko-no-tatsujin-wii-u-version,Music,,WiiU,Namco Bandai Games,Bandai Namco Games,,,,0.0,0.19,,,0.19,,2013.0,18th Sep 18,http://www.vgchartz.com/game/77451/taiko-no-tatsujin-wii-u-version/?region=All,1,,/games/boxart/full_2510286JapanFrontccc.jpg,0.19, 
9010,Bless Online,bless-online,MMO,,PC,Unknown,Neowiz Corporation,,,,0.19,0.0,,,,,2013.0,01st Mar 19,http://www.vgchartz.com/game/223757/bless-online/?region=All,1,,/games/boxart/full_61596AmericaFrontccc.jpg,0.19, 
9011,Disney's Magical Mirror Starring Mickey Mouse,disneys-magical-mirror-starring-mickey-mouse,Adventure,E,GC,Nintendo,Capcom,,4.0,,0.0,0.19,0.15,0.04,,0.01,2002.0,,http://www.vgchartz.com/game/541/disneys-magical-mirror-starring-mickey-mouse/?region=All,1,,/games/boxart/3124017ccc.jpg,0.19, 
9012,Dawn of Discovery,dawn-of-discovery,Simulation,E10,Wii,Ubisoft,Sunflowers Interactive,,7.9,,0.0,0.19,0.12,0.06,,0.01,2009.0,,http://www.vgchartz.com/game/32231/dawn-of-discovery/?region=All,1,7.8,/games/boxart/full_8891168AmericaFrontccc.jpg,0.19,"
Dawn of Discovery takes place in 1404: King Georges’ land is suffering from droughts and famine. Aware of the distress of his citizens, the King decides to send his two sons, William and Edward to gain new territories in order to produce enough goods to satisfy the inhabitants. Whereas Edward suggests fighting to collect the precious resources, his brother, William offers a peaceful solution proposing to explore new and unsettled lands in the south of the Kingdom. With the agreement of his father, William heads to the South and discovers the mysterious orient culture.  Features

Explore & create with fun and ease

Explore a beautiful world, discover new places to settle and create your own realm
Learn from other cultures (Oriental, European…) & expand your horizons
All the controls are intuitive, the interface is fully adapted to the consoles’ gameplay


Discover how to manage cities & societies

Be considerate, plan wisely and learn to manage resources
Satisfy the needs of your citizens and care for your society


Enjoy friendly, peaceful family entertainment

Relax & build your cities in a rich and peaceful world
Play together with your family & friends and let them help you to create your world thanks to the 2-player co-op mode for Wii 



 "
9013,Super Star,super-star,Visual Novel,,PC,Unknown,Dream Works,,,,0.19,0.0,,,,,2009.0,01st Mar 19,http://www.vgchartz.com/game/223758/super-star/?region=All,1,,/games/boxart/full_975275AmericaFrontccc.jpg,0.19, 
9014,FIFA 17,fifa-17,Sports,E,PC,Electronic Arts,EA Canada,,,,0.0,0.19,,0.18,,0.01,2016.0,28th Mar 18,http://www.vgchartz.com/game/131413/fifa-17/?region=All,1,,/games/boxart/full_6678540PALFrontccc.jpg,0.19, 
9015,Barbie Fashion Show: An Eye for Style,barbie-fashion-show-an-eye-for-style,Misc,E,DS,Activision,Activision,,,,0.0,0.19,0.18,0.0,,0.01,2008.0,,http://www.vgchartz.com/game/27438/barbie-fashion-show-an-eye-for-style/?region=All,1,,/games/boxart/full_9084230AmericaFrontccc.jpg,0.19," Now you can put your personal mark on the fashion world!Thousands of Customizable Options!    -Design skirts, dresses, shoes, fabrics, and more!    -Choose the models, hair & accessories, music, poses, lighting, stages, and more!10 Glamorous Fashion Shows    -Including 45 unique design challenges10 Different Character Models    -Design clothes to dress 10 different characters (5 female, 5 male) while interacting with Barbie™ and Teresa™Design Fashions for the Perfect Date!    -Create boy and girl fashions for dances, weddings, and more!Create Your Own Photo Shoot    -Print and share photos with your friends
Activision "
9016,Final Fantasy XI: Online,final-fantasy-xi-online,Role-Playing,T,X360,Square Enix,Square Enix,,6.7,,0.0,0.19,0.17,0.01,,0.01,2006.0,,http://www.vgchartz.com/game/763/final-fantasy-xi-online/?region=All,1,,/games/boxart/full_7428182AmericaFrontccc.jpg,0.19,"
Explore the living online world of Vana'diel in FINAL FANTASY® XI. The Rise of the Zilart™ and Chains of Promathia expansion packs provide fifteen unique jobs and hundreds of areas. Frequent updates and events add to the award-winning visuals, innovative gameplay, and deep story line of the world-renowned FINAL FANTASY series.




Online RPG: First massively multiplayer online roleplaying game (MMORPG) in the renowned FINAL FANTASY series.
Cross-platform title: First MMORPG that lets gamers connect to the same gaming world, regardless of platform.
Varied quests: From one of three starting nations, players can undertake conquests to elevate their nation's standing, missions to build their reputation within a nation, and quests to discover useful items, earn money, uncover valuable information, and learn more about the story of Vana'diel.
Custom characters: Personalize your character with a host of physical traits and jobs. Gain the ability to equip and switch support jobs at any time. 
Special quests: Participate in missions to unlock exciting new jobs such as ""Dark Knight,"" ""Summoner,"" and ""Ninja."" 
Intuitive battle system: Experience a complex yet well-balanced battle system fit for beginners and experienced gamers alike. Perform strategic attacks using magic, job abilities, and weapon skills.
Huge world: More than 100 areas to explore including mountains, forests, ice plains, deserts, oceans, rivers, castles, and dungeons.
Changing time, climate, and weather: Live in a persistent world with time and climate changes that range from full day/night cycles to desert sandstorms, thunderstorms, fog, and snow.
Helpful features: Players will be able to play at their own pace and form parties by using various integrated communication tools, including PlayOnline Chat and PlayOnline Mail.
Gorgeous, complex saga: Experience the same visual style and deep story lines that have become a staple of the FINAL FANTASY series.
PlayOnline Viewer software: With communication tools, access to support, customization tools, and games, including the enhanced online version of the Tetra Master card game from FINAL FANTASY® IX.
Rise of the Zilart expansion pack: Explore new areas and features.



 
Xbox.com "
9017,IHRA Professional Drag Racing 2005,ihra-professional-drag-racing-2005,Racing,E,PS2,Bethesda Softworks,Bethesda Softworks,,,,0.0,0.19,0.09,0.07,,0.02,2004.0,,http://www.vgchartz.com/game/5214/ihra-professional-drag-racing-2005/?region=All,1,,/games/boxart/full_5233466AmericaFrontccc.jpg,0.19,"From the creators of the most successful drag racing                              games in the world comes the next generation of drag                              racing action - IHRA Professional Drag Racing 2005 (IHRA                              Pro). IHRA Pro takes this best-selling series to a new                              level with its outstanding graphics, realistic physics,                              presentation, and, most importantly, intense racing                              action.

Experience realistic racing with fully detailed                                  weather and atmospheric dynamics  
Choose from more than 35 vehicles, including classics                                  and late models  
Features top cars and drivers from Top Fuel, Pro                                  Mod, Pro Stock, and Funny Car  

Customize 70 vehicle components,                                      from tires to transmissions to electronics 

Race a single event, a whole season, or go head-to-head                                  against a friend!   

Source - www.bethsoft.com (publisher) "
9018,SpongeBob's Surf & Skate Roadtrip,spongebobs-surf-amp-skate-roadtrip,Action,E,X360,THQ,THQ,,,,0.0,0.19,0.15,0.03,,0.02,2011.0,,http://www.vgchartz.com/game/59924/spongebobs-surf-amp-skate-roadtrip/?region=All,1,,/games/boxart/full_spongebobs-surf-amp-skate-roadtrip_568AmericaFront.jpg,0.19,"GRAB YOUR BOARD. CARVE IT UP!
Hit the sand and surf with SpongeBob and his   best pal, Patrick, for some super boarding escapades! Ride mondo waves   and winding waterways, and skate gnarly seaside streets and ramps for   hours of challenges that’ll test your awesome boarding skills.  SpongeBob’s Surf & Skate Roadtrip is non-stop action! SpongeBob and   his bodacious Bikini Bottom buddy jump on surfboards and skateboards to   explore a brand new, never-before-seen world!

For the first time ever, you can BE SpongeBob
Augmented reality—move your hand through the water and watch it splash!
Compete and play with   friends – show off your awesome tricks and mind-blowing stunts in   head-to-head play (2-player split-screen) 
12 awe-inspiring environments – 6 for each sport—and unlimited ways to perfect your board skills

 
THQ "
9019,Mace Griffin: Bounty Hunter,mace-griffin-bounty-hunter,Shooter,M,PS2,VU Games,Warthog,,,,0.0,0.19,0.09,0.07,,0.02,2003.0,,http://www.vgchartz.com/game/5282/mace-griffin-bounty-hunter/?region=All,1,,/games/boxart/full_3775020AmericaFrontccc.jpg,0.19,"Mega-corporations, strange religious sects, and futuristic gunslingers - they’re all that stand between Mace Griffin and the revenge he seeks for false imprisonment.As Mace Griffin, you’ll track your prey across the depths of space while unraveling a mystery deeper and more dangerous than you can believe. The cinematic storyline will take you through 13 expansive missions, seamlessly transitioning between epic space battles in 6 different ships and first-person ground combat on planet surfaces and space stations.In Space or on Land - Hunt Them Down™
www.us.playstation.com "
9020,The Spiderwick Chronicles,the-spiderwick-chronicles,Adventure,E10,Wii,Sierra Entertainment,Stormfront Studios,,,,0.0,0.19,0.17,0.01,,0.01,2008.0,,http://www.vgchartz.com/game/15713/the-spiderwick-chronicles/?region=All,1,,/games/boxart/5301985ccc.jpg,0.19,"Their World is Closer Than You Think.The Spiderwick Chronicles™ is a best-selling book series by Holly Black and Tony DiTerlizzi in which twin brothers Jared and Simon, along with their sister Mallory Grace, embark on a perilous journey filled with adventure and danger.The Spiderwick Chronicles video game is based on the upcoming film adaptation by Paramount Pictures and Nickelodeon Films and will feature multiple playable characters, each with unique abilities.
Sierra Entertainment "
9021,Legacy of Kain: Defiance,legacy-of-kain-defiance,Adventure,M,XB,Eidos Interactive,Crystal Dynamics,,,,0.0,0.19,0.14,0.04,,0.01,2003.0,,http://www.vgchartz.com/game/1156/legacy-of-kain-defiance/?region=All,1,,/games/boxart/771798ccc.jpg,0.19,"The next chapter in the epic Legacy of Kain series is a cutting-edge action/adventure game featuring more action then ever before. Take control of two powerful and highly evolved vampires: Kain, an all-powerful demigod, and Raziel, a demonic angel of death. Each equipped with a legendary sword, Kain & Raziel must battle through a world loaded with conflict and intrigue as they attempt to unravel their destinies and defeat the dark forces that seek to condemn their world to eternal damnation.

Features:

Play as both Kain and Raziel, two powerful and highly evolved vampires with unique abilities


Engage in intense combat utilizing thrilling combo moves, and physical agility to destroy hordes of human, demonic, and undead foes



 

Utilize telekinetic powers to manipulate the environment and hurl your enemies into obstacles, impale them on sharp objects, or throw them off ledges to their deaths


Feed your dark hunger by sucking the blood and devouring the souls of your enemies to survive


Possess the bodies of unsuspecting victims to shift between the shadowy and sinister Spectral Realm and the rich and beautiful Material Plane


Source - www.eidosinteractive.com (publisher) "
9022,Jalopy,jalopy,Simulation,,PC,Unknown,Minskworks,,,,0.19,0.0,,,,,2003.0,01st Mar 19,http://www.vgchartz.com/game/223759/jalopy/?region=All,1,,/games/boxart/full_8410235AmericaFrontccc.jpg,0.19, 
9023,Trivial Pursuit unhinged,trivial-pursuit-unhinged,Misc,T,PS2,Atari,Artech Studios,,,,0.0,0.19,0.09,0.07,,0.02,2004.0,,http://www.vgchartz.com/game/5945/trivial-pursuit-unhinged/?region=All,1,,/games/boxart/full_5418468AmericaFrontccc.jpg,0.19,"The world's most popular trivia game is about to become a wild free-for-all! With incredible new game features, this all-new version of the Trivial Pursuit game rewards the clever, the speedy and the sneaky-- while still highlighting everybody's trivia talents. "
9024,Tales of the World: Narikiri Dungeon 2,tales-of-the-world-narikiri-dungeon-2,Role-Playing,,GBA,Namco,Alfa System,,,,0.0,0.19,,,0.19,0.0,2002.0,,http://www.vgchartz.com/game/4510/tales-of-the-world-narikiri-dungeon-2/?region=All,1,,/games/boxart/full_4165818JapanFrontccc.jpg,0.19,"Tales of the World: Narikiri Dungeon 2 is a Role-Playing game, developed by Alfa System and published by Namco,  which was released in Japan in 2002. "
9025,Majin and the Forsaken Kingdom,majin-and-the-forsaken-kingdom,Adventure,T,X360,Namco Bandai,Game Republic,,7.0,,0.0,0.19,0.14,0.03,0.0,0.01,2010.0,,http://www.vgchartz.com/game/43812/majin-and-the-forsaken-kingdom/?region=All,1,,/games/boxart/full_majin-and-the-forsaken-kingdom_0AmericaFront.jpg,0.19,"Wrapped in an emotional journey of courage and respect, Majin and the Forsaken Kingdom takes players on a majestic adventure as a cunning individual who must rely on his agility to triumph over increasing obstacles. What he lacks in might, his AI-controlled companion makes up for with his towering size and brawn. 

Majin and the Forsaken Kingdom redefines co-op AI gameplay by delivering an accessible experience that offers the perfect mix of stealth, action, platform navigation and combat that is designed to keep the journey gripping and immersive. Though each character has their own objective, teamwork is essential for survival as the hero and Majin must fight in tandem to persevere over any challenge that lies in their path. This complementary relationship will only continue to deepen and evolve as the story unfolds. "
9026,Aliens versus Predator: Extinction,aliens-versus-predator-extinction,Strategy,T,PS2,Electronic Arts,Zono Incorporated,,,,0.0,0.19,0.09,0.07,,0.02,2003.0,,http://www.vgchartz.com/game/4815/aliens-versus-predator-extinction/?region=All,1,,/games/boxart/full_9777855AmericaFrontccc.jpg,0.19,"Survival Of The Fiercest
Battle for control of planet LV-742 as aliens, predators, or colonial marines in this tactical strategy game based on the aliens versus predator universe. Choose a species and outmaneuver your enemies for Hi-Tech weaponry. Upgrades, and control of the planet. Only by utilizing the unique advantages of your breed can you determine the fate of your species.

Engage and annihilate opposing forces in over 20 unique maps, from jungles to caverns to Hi-Tech laboratories.
Use specialized weapons including Colonial marine pulse rifles, predator bleeder spears, and alien face huggers to defeat foes.
Control and upgrade never-before-seen aliens, predators, and marines, each with unique tactical advantages.

--Box "
9027,Silent Scope 2: Dark Silhouette,silent-scope-2-dark-silhouette,Shooter,M,PS2,Konami,Konami Computer Entertainment Tokyo,,,,0.0,0.19,0.09,0.07,,0.02,2001.0,,http://www.vgchartz.com/game/26937/silent-scope-2-dark-silhouette/?region=All,1,,/games/boxart/full_8180247AmericaFrontccc.jpg,0.19,"The arcade smash hit Silent Scope 2: Dark Silhouette comes to the PlayStation 2 with twice the adrenaline-pumping action of the original, with all-new two-player modes!Hiding from rooftops, bridges, and other environments, use your sniper scope to take down enemy targets to save innocent lives. With simultaneous cooperative and competitive play, two players can take aim to see who is the best sniper!
us.playstation.com "
9028,Dave Mirra Freestyle BMX 2,dave-mirra-freestyle-bmx-2,Sports,T,GBA,Acclaim Entertainment,Full Fat,,8.0,,0.0,0.19,0.14,0.05,,0.0,2001.0,,http://www.vgchartz.com/game/18694/dave-mirra-freestyle-bmx-2/?region=All,1,,/games/boxart/4331479ccc.jpg,0.19,"Featuring 10-time World Champion Dave Mirra, this game will redefine extreme sports video games. This true sequel lets you ride as one of 14 top pros, build a killer BMX park from the ground up, pull over 1,500 tricks, and explore 8 massive levels.  Play the game that delivers the most engaging next-generation BMX experience anywhere!

 The only game that features 10 time world champion and 11 time X-Games champion, Dave Mirra
 State of the art Park Editor lets you create your own BMX experience
 A roster of 14 BMX pros exclusively including Dave Mirra, Ryan Nyquist, and Rick Moliterno
 8 massive levels, 4x bigger than before, for the very best in vert, dirt, street and park riding and all of Camp Woodward
 Innovative S.I.K. trick system with the new grind, wall ride, manual and lip trick modifiers, lets you pull over 1500+ tricks
 10 super-competitive multiplayer games
 Compete to earn more than 40 real-life BMX sponsors during your ProQuest experience
 Killer soundtrack featuring: Ozzy Osbourne, The Cult, Methods of Mayhem and Godsmack

Playstation "
