Rank,Name,basename,Genre,ESRB_Rating,Platform,Publisher,Developer,VGChartz_Score,Critic_Score,User_Score,Total_Shipped,Global_Sales,NA_Sales,PAL_Sales,JP_Sales,Other_Sales,Year,Last_Update,url,status,Vgchartzscore,img_url,Global_Total,Summary
9473,UFC: Sudden Impact,ufc-sudden-impact,Fighting,T,PS2,Global Star Software,Opus Studio,,,,0.0,0.18,0.09,0.07,,0.02,2004.0,,http://www.vgchartz.com/game/2558/ufc-sudden-impact/?region=All,1,,/games/boxart/full_7667339AmericaFrontccc.jpg,0.18,"UFC: Sudden Impact gives you all the mixed martial arts action found only in the Octagon. You can create and customize your own Ultimate Fighter and then fight your way through five gameplay modes, including Tournament and Story. The game includes such UFC superstars as Chuck Liddell, Tito Ortiz, Ken Shamrock, and Matt Hughes, as well as 10 unlockable and six hidden fighters. You can choose from 15 different fighting disciplines, positions, and moves.
Playstation "
9474,Dynasty Warriors: Gundam 3,dynasty-warriors-gundam-3,Action,T,X360,Tecmo Koei,Omega Force,,6.5,,0.0,0.18,0.11,0.03,0.02,0.01,2011.0,,http://www.vgchartz.com/game/47200/dynasty-warriors-gundam-3/?region=All,1,,/games/boxart/full_dynasty-warriors-gundam-3_904AmericaFront.jpg,0.18,"THE NEXT LEVEL OF MOBILE SUIT BATTLE IS HERE
DYNASTY WARRIORS®: GUNDAM® 3 represents the next generation of  futuristic mecha action with graphical and gameplay additions, bringing  authenticity and astounding improvements to the series. Set in the  future, chaotic warfare has engulfed the universe. The world is ripe  with strife as gigantic mecha called Mobile Suits march to war on land  and in space. Featuring characters and mecha from over 30 years of  Gundam anime and manga series, DYNASTY WARRIORS: GUNDAM 3 is the mecca  of mecha!
Features:-
• Mecha overload – Over 50 playable and upgradable characters and  over 70 playable and upgradeable Mobile Suits combed from the Gundam  universe, including new Mobile Suits from Mobile Suit Gundam 00, Mobile  Suit Gundam UC and many more.
• Anime in motion – Experience the Gundam anime and manga series come  to life with an entirely new cel-shaded graphical treatment.
• Deeper gameplay systems – Enhanced and aggressive enemy AI adds to  the challenge while new gameplay systems, including Partner Strike  (summon partner characters to the battlefield at crucial moments),  Emergency Dash (negate enemy attacks with new cancel and evasion moves)  and Recovery Gauge (recover health during battle) expand the level of  strategy and depth to the gameplay.
• Story mode returns – the popular mode originally introduced in the  first DYNASTY WARRIORS: GUNDAM is back with an entirely new campaign.
• The biggest game yet – Tremendously deep with over hundreds of  hours of gameplay! PLUS the limitless replay value of online multiplayer  with up to 4 players.
(Official site) "
9475,OneShot,oneshot,Puzzle,,PC,Unknown,Little Cat Feet,,,,0.18,0.0,,,,,2011.0,09th Mar 19,http://www.vgchartz.com/game/223818/oneshot/?region=All,1,,/games/boxart/full_7391648AmericaFrontccc.jpg,0.18, 
9476,NBA Hoopz,nba-hoopz,Sports,E,PS2,Midway Games,Eurocom Entertainment Software,,,,0.0,0.18,0.09,0.07,,0.02,2001.0,,http://www.vgchartz.com/game/43476/nba-hoopz/?region=All,1,,/games/boxart/full_6355238AmericaFrontccc.jpg,0.18,"NBA Hoopz is the only basketball videogame featuring a dedicated 3 on 3 gameplay format this season.  What is NBA Hoopz? It's the newest high- flying, on-fire, NBA Licensed, arcade-style basketball game from Midway sports Asylum.. The dedicated 3 on 3 format means that you can take flight with a lighting quick guard, pull up for the baseline jumper with a forward or just tear down the backboard with a thunderous slam from a center.  NBA MVP Shaquille O'Neal brought his big =-man moves to NBA Hoopz to add power to the non-stop, over the top action.  With NBA Hoopz the choice is yours dishin' the rock takin it to the rack or bringing down the house! What's your game? "
9477,Nancy Drew: The Hidden Staircase,nancy-drew-the-hidden-staircase,Adventure,E,DS,THQ,Gorilla Systems,,,,0.0,0.18,0.16,,,0.01,2008.0,,http://www.vgchartz.com/game/24718/nancy-drew-the-hidden-staircase/?region=All,1,,/games/boxart/1944097ccc.jpg,0.18,"NANCY'S ON THE CASE! Family heirlooms are disappearing all over Twin        Elms. The residents are counting on Nancy Drew to solve the mystery        before it's too late!

 Interview people and gather clues using the stylus to uncover the          location of the hidden staircase. 
 Explore the large and mysterious Twin Elms house and examine anything          that is out of place. 
 Earn the top rank of Master Detective and find the stolen items. 

Nintendo "
9478,ESPN X Games Skateboarding,espn-x-games-skateboarding,Sports,E,GBA,Konami,Konami Computer Entertainment Hawaii,,5.7,,0.0,0.18,0.13,0.05,,0.0,2001.0,,http://www.vgchartz.com/game/36895/espn-x-games-skateboarding/?region=All,1,,/games/boxart/full_9195347AmericaFrontccc.jpg,0.18,"ESPN X-Games Skateboarding features eight different pro skateboarders, including Bob Burnquist and Chris Senn. Choose from X Games, Free Skate, and X-Rage modes. A tutorial helps you increase your gameplay skills. You can also practice more than 40 tricks to earn experience points for higher jumps, improved balance, and increased speed. "
9479,Dragonia,dragonia,Shooter,,PC,Unknown,Blue Studio,,,,0.18,0.0,,,,,2001.0,09th Mar 19,http://www.vgchartz.com/game/223819/dragonia/?region=All,1,,/games/boxart/full_1388290AmericaFrontccc.jpg,0.18, 
9480,College Hoops 2K8,college-hoops-2k8,Sports,E,X360,2K Sports,Visual Concepts,,,,0.0,0.18,0.16,,,0.01,2007.0,,http://www.vgchartz.com/game/12837/college-hoops-2k8/?region=All,1,,/games/boxart/full_1329422AmericaFrontccc.jpg,0.18,"College Hoops 2K8, the #1 selling college basketball game last year and the #1 rated college basketball game five years running returns to the Xbox 360™, PLAYSTATION®3 and PlayStation®2. This year's game gets the deepest feature enhancements in the history of the franchise and is sure to be a contender to repeat as what Operation Sports crowned ""Basketball Game of the Year"" for 2006.
Take 2 "
9481,Speedball 2100,speedball-2100,Sports,E,PS,Take-Two Interactive,Bitmap Brothers,,,,0.0,0.18,0.1,0.07,,0.01,2000.0,,http://www.vgchartz.com/game/42396/speedball-2100/?region=All,1,,/games/boxart/full_1247844AmericaFrontccc.jpg,0.18,"In the year 2100, the bloodsport of choice is Speedball, a game that has only one hard-and-fast rule: slam a solid chromium ball into your opponent's goal. Managing Brutal Deluxe, the laughing stock of the World Speedball League, you've got nothing to lose. If winning is less about sportsmanship and more about playing dirty, using power-ups, and hospitalizing your opponents, then you've got to be a brute and a casual killer to succeed. This 32-bit update to the original Speedball is best described as a futuristic combination of hockey and rollerball. Speedball 2100 pits two teams of nine players in a cage-like arena where they attempt to score by sending a steel ball past the goalie and into the small goal box. You can bounce the ball off the walls, and you can send opponents flying to the floor with a friendly shoulder charge. Fans of the predecessor will appreciate this sequel.
Playstation "
9482,Velvet Assassin,velvet-assassin,Shooter,M,X360,SouthPeak Interactive,Replay Studios,,5.3,,0.0,0.18,0.14,0.02,0.01,0.01,2009.0,,http://www.vgchartz.com/game/23754/velvet-assassin/?region=All,1,3.2,/games/boxart/full_9754156AmericaFrontccc.jpg,0.18,"

Inspired by the fascinating story and unbreakable spirit of British secret agent Violette Szabo, players take control of Violette Summer, a beautiful spy deep behind enemy lines during World War II. Intense stealth-action gameplay with a startling real-time lighting system and surreal visuals combine to produce an incredible gaming experience. Through third-person gameplay, sneak up on enemies and pull the pins from their belted grenades. Infiltrate a Gestapo prison and slip cyanide to your own men before the Germans make them talk. Slink through the shadows to finish off your unsuspecting enemies with a single, silent move. Through Violette's fever dreams, experience what she experienced. Walk where she walked. And kill those she killed.

Brutal assassinations
Stylized environments modeled after actual World War II locations
Adjustable skills allow you to change Violette's attributes to suit your playing style
Dynamic lighting brings an intense gaming experience
Use historically accurate World War II guns and knives to viciously execute your enemies
Stunningly vibrant environments as rich and haunting as the dreams and memories that inspired them.



Source: SouthPeakGames.com
 "
9483,Intrusion 2,intrusion-2,Shooter,,PC,Unknown,Aleksey Abramenko,,,,0.18,0.0,,,,,2009.0,09th Mar 19,http://www.vgchartz.com/game/223820/intrusion-2/?region=All,1,,/games/boxart/full_4254743AmericaFrontccc.jpg,0.18, 
9484,EyePet & Friends,eyepet-amp-friends,Simulation,E,PS3,Sony Computer Entertainment,SCEE London Studio,,,,0.0,0.18,0.06,0.09,,0.03,2011.0,,http://www.vgchartz.com/game/51920/eyepet-amp-friends/?region=All,1,,/games/boxart/full_5986026AmericaFrontccc.jpg,0.18,"Twice the Magic, Endless Fun
 
Everybody's favorite furball is back...and, this time, he's  bringing along another fun-loving friend! In EyePet & Friends, you  use the PlayStation Eye camera and PlayStation Move motion controller to  nurture and play with multiple EyePets for endless hours of mischievous  fun. You can even create brand new toys and activities, and then share  them with your friends in the new EyePet online community!

Use up to two PlayStation Move motion controllers to play with two EyePets at once.


Brand new toys like the laser pointer and trick stick will make Play Time even more fun for you and your EyePets.


Teach your pets to perform tricks, or play all new game challenges and activities. 


Get messy in the Creativity Center, where you'll design toys and custom outfits. 


Earn Pet Tokens to spend on new content for the game and determine how your pet progresses.


Share your EyePets' achievements and connect with friends on the new online EyePet community.

 
- Playstation Website  "
9485,LEGO Island 2: The Brickster's Revenge,lego-island-2-the-bricksters-revenge,Adventure,E,PS,LEGO Media,Silicon Dreams,,,,0.0,0.18,0.1,0.07,,0.01,2001.0,,http://www.vgchartz.com/game/43639/lego-island-2-the-bricksters-revenge/?region=All,1,,/games/boxart/full_8477518AmericaFrontccc.jpg,0.18,"The Brickster is back and out to cause more mischief in this wild, racing, chasing, island-hopping sequel. In your quest to piece together The Informaniac's Constructopedia, you'll drive, scuba-dive, fly a place and even ride a dinosaur as you chase the Brickster down through these amazing new LEGO® worlds. Meet all kinds of fun characters along the way as you journey through the game. You'll need all your skills to solve the puzzles and achieve your ultimate goal, to prevent LEGO Island being ruined. "
9486,PuppyStory,puppystory,Platform,,PC,Unknown,Tatyana Murzina,,,,0.18,0.0,,,,,2001.0,09th Mar 19,http://www.vgchartz.com/game/223821/puppystory/?region=All,1,,/games/boxart/full_5997419AmericaFrontccc.jpg,0.18, 
9487,Backyard Basketball,backyard-basketball,Sports,E,GBA,Atari,Mistic Software,,6.0,,0.0,0.18,0.13,0.05,,0.0,2004.0,,http://www.vgchartz.com/game/26222/backyard-basketball/?region=All,1,,/games/boxart/3430765ccc.jpg,0.18,"Hit the Backyard Basketball hardwood with kid versions of NBA stars! Play with ten NBA pros including Kevin Garnett, Tracy McGrady, Yao Ming and more. Backyard Basketball lets you pick your favorite players, suit them up in NBA gear, choose a cool court and control all the action! Easy gameplay means quick dribbling, sharp passing and exciting 3-pointers — it’s a true Backyard Sports experience for hoops fans that want to play with the pros!  "
9488,Madden NFL 09,madden-nfl-09,Sports,E,XB,EA Sports,EA Tiburon,,,,0.0,0.18,0.13,0.04,,0.01,2008.0,,http://www.vgchartz.com/game/24043/madden-nfl-09/?region=All,1,,/games/boxart/full_2281080AmericaFrontccc.jpg,0.18,"Celebrating 20 Years of Innovation and counting, Madden NFL 09 delivers its most authentic NFL football experience ever.
Real Football Intelligence
Celebrating 20 Years of Innovation, Madden NFL 09 delivers its most complete football package ever for the PlayStation 2, combining a more authentic gameplay simulation experience and deeper game modes for the hard core fans with all-new EA SPORTS Family Play, featuring an easy-to-use control system that help rookies master the game. With the new QB Avoidance Stick and new combo moves, plus an enhanced Fantasy Challenge and all-new SuperSim, the franchise takes its next leap in bringing you the ultimate football experience with Madden NFL 09, the most authentic and adaptable game in sports video game history.
 Fun, Accessible Family Play 
Anybody can dominate the game like a pro with EA SPORTS Family Play. An all-new playcalling system features simplified one-button controls and assisted player movements, making Madden NFL 09 the most accessible football game ever.
 All-New Franchise Scoring System 
Earn points at season's end in Franchise mode by accumulating a winning record during the regular and post-season, progressing your players from no-name status to superstar calibre, increasing attendance, drafting elite players, and more.
 New SuperSim 
Take full control over the pace of a game by simulating a single play, a quarter, a half, or an entire game. Take the field or take plays off, it's entirely up to you.
 Earn Your Stripes 
Use points earned in practice to improve your skills and overtake players ahead of you on the depth chart, then do whatever it takes to meet your team's expectations by reaching key incentives that are written in your contract.
 Enhanced Fantasy Challenge 
Three new league champions with unique special abilities have joined the fray with one goal in mind: knocking you from your championship run. Defeat each champ in the new Champions Stadium at the end of each league and you'll advance to the next tier.
 Most Authentic Gameplay Ever 
Pull off new combo moves by stringing together multiple actions in succession or direct receivers' routes when scrambling out of the pocket with your quarterback. An enhanced gameplay system also features the QB Avoidance Stick, allowing your quarterback to avoid pressure while in the pocket by quickly scrambling away in four different directions.
 
Source - www.electronicarts.co.uk (publisher) "
9489,Backbreaker,backbreaker,Sports,E,PS3,505 Games,NaturalMotion Games,,,,0.0,0.18,0.16,,,0.02,2010.0,,http://www.vgchartz.com/game/42980/backbreaker/?region=All,1,,/games/boxart/full_backbreaker_933AmericaFront.jpg,0.18,"Backbreaker redefines gameplay in the football video game genre with a stunning on-field camera view, accessible controls and a relentless onslaught of hard-hitting tackles. With NaturalMotion's acclaimed euphoria motion synthesis engine featured in a sports title for the very first time, Backbreaker offers intense gameplay, dazzling graphics and an endless variety of unique football moments. From the moment players step onto the gridiron, Backbreaker is in a class of its own. "
9490,Fancy Nancy: Tea Party Time!,fancy-nancy-tea-party-time,Adventure,E,DS,THQ,Webfoot Technologies,,,,0.0,0.18,0.16,,,0.01,2010.0,,http://www.vgchartz.com/game/47044/fancy-nancy-tea-party-time/?region=All,1,,/games/boxart/full_fancy-nancy-tea-party-time_10AmericaFront.jpg,0.18,"You are cordially invited to celebrate with  Fancy Nancy at the most fantastic tea party in the neighborhood hosted  by the fabulous Mrs. DeVine!

Oh! What to wear? Dress Nancy in 6 different ensembles (that’s fancy for “outfits”) for the tea party!
Join Nancy at the fabulous tea party or create glamorous stickers using your Nintendo DSi™.
Play 5 exciting mini-games to earn more Fancies and uncover marvelous tea party supplies.
Search Nancy’s world for the Fanciest beads that can be traded for special surprises for Nancy’s Room.

 
THQ "
9491,How to Train Your Dragon 2,how-to-train-your-dragon-2,Action-Adventure,E10,X360,Little Orbit,Torus Games,,,,0.0,0.18,0.06,0.1,,0.01,2014.0,17th Mar 18,http://www.vgchartz.com/game/80176/how-to-train-your-dragon-2/?region=All,1,,/games/boxart/full_4658800PALFrontccc.jpg,0.18,"Become the ultimate Dragon Racer! Return to the epic Island of Berk,  where The Dragon Races have become the awesome new sport for Viking  adrenaline junkies. Hiccup, Astrid, Snotlout, Fishlegs, Tuffnut and Ruffnut and their  Dragons are now competing in fierce tournaments to determine the  ultimate Dragon Rider. Choose your Dragon Racer, soar through clouds,  and explore new unmapped territories. Discover hidden locations, unlock  mysterious Dragon Riders, and join in epic races across the beautiful  yet treacherous Island of Berk.

 Choose your Rider and Dragon to train and compete in races and tournaments  
 Challenge a friend to claim the title of Best Dragon Rider  
 Explore the mysterious Island of Berk to discover hidden quests  
 Collect tokens and complete challenges to unlock new Dragon traits and abilities  
 Discover two unlockable secret charactersSource: Developer
 "
9492,Scooby-Doo! Unmasked,scooby-doo-unmasked,Platform,E,GBA,THQ,Artificial Mind and Movement,,,,0.0,0.18,0.13,0.05,,0.0,2005.0,,http://www.vgchartz.com/game/28353/scooby-doo-unmasked/?region=All,1,,/games/boxart/full_8324918AmericaFrontccc.jpg,0.18,"Ruh-roh! Fred's cousin, Jed, is nowhere to be found! His animatronic monsters have gone haywire and are attacking everyone in sight! It's up to Scooby-Doo and Mystery, Inc. to stop the creepy costumed creatures and find Jed before it's too late... "
9493,Summon Night 4,summon-night-4,Role-Playing,,PS2,Banpresto,Flight-Plan,,,,0.0,0.18,,,0.18,,2006.0,,http://www.vgchartz.com/game/4407/summon-night-4/?region=All,1,,/games/boxart/full_5478840JapanFrontccc.jpg,0.18, 
9494,NHL 2004,nhl-2004,Sports,E,XB,EA Sports,EA Black Box,,,,0.0,0.18,0.13,0.04,,0.01,2003.0,,http://www.vgchartz.com/game/1620/nhl-2004/?region=All,1,,/games/boxart/5597659ccc.jpg,0.18,"NHL® 2004 offers the most physically intense and authentic representation of hard-hitting NHL action to date. Use the new right analog Bruise Control™ to power up and throw bone-crushing hits. Grapple with opponents using a completely revamped and more realistic fighting system. Off the ice, NHL 2004 sets a new standard for sports games with its deep GM Dynasty Mode™. With 39 new elite teams, in addition to all-new passing controls, player collisions, skating animations, play-by-play, 3-D crowds, on-the-fly strategy calling, and so much more, NHL 2004 is the definitive hockey experience.
This title is playable on Xbox 360™ with a software emulator. Please see http://www.xbox.com/en-us/games/backwardscompatibility.htm for more details.
 
Xbox.com "
9495,Pro Yakyuu Spirits 5,pro-yakyuu-spirits-5,Sports,,PS2,Konami,PawaPuro Production,,,,0.0,0.18,,,0.18,,2008.0,,http://www.vgchartz.com/game/18550/pro-yakyuu-spirits-5/?region=All,1,,/games/boxart/full_8893855JapanFrontccc.jpg,0.18, 
9496,Namco Museum: 50th Anniversary,namco-museum-50th-anniversary,Misc,E10,XB,Namco,Digital Eclipse,,,,0.0,0.18,0.13,0.04,,0.01,2005.0,,http://www.vgchartz.com/game/5414/namco-museum-50th-anniversary/?region=All,1,,/games/boxart/3767532ccc.jpg,0.18,"14 Classic Arcade Games Include:  Pac-Man Ms. Pac-Man Galaga Galaxian Dig Dug Pole Position Pole Position II Rolling Thunder Rally X Bosconian Dragon Spirit Sky Kid Xevious Mappy  Sky Kid and Rolling Thunder are two new titles new to Namco Museum.
 
Source - www.namcobandaigames.com (publisher) "
9497,Country Dance: All Stars,country-dance-all-stars,Music,E10,X360,GameMill Entertainment,GameMill Entertainment,,,,0.0,0.18,0.16,,,0.02,2012.0,04th Nov 18,http://www.vgchartz.com/game/70608/country-dance-all-stars/?region=All,1,,/games/boxart/full_2973724AmericaFrontccc.jpg,0.18, 
9498,NFL 2K2,nfl-2k2,Sports,E,XB,Sega,Visual Concepts,,,,0.0,0.18,0.13,0.04,,0.01,2002.0,,http://www.vgchartz.com/game/1585/nfl-2k2/?region=All,1,,/games/boxart/3597053ccc.jpg,0.18,"Sega Sports NFL 2K2 hits the Gridiron on the Xbox video game system, with the look and feel of a champion. With all-new gameplay animations and platform-specific features, NFL 2K2 combines flash and substance in a football game that is as exciting to watch as it is to play.
This title is playable on Xbox 360™ with a software emulator. Please see http://www.xbox.com/en-us/games/backwardscompatibility.htm for more details.
 
Xbox.com "
9499,NBA Starting Five,nba-starting-five,Sports,E,PS2,Konami,Konami,,,,0.0,0.18,0.09,0.07,,0.02,2002.0,,http://www.vgchartz.com/game/5458/nba-starting-five/?region=All,1,,/games/boxart/9257046ccc.jpg,0.18,"Get off the bench and get inside the ultimate NBA Experience. Tracy McGrady and the rest of the NBA bring an All-Star performance that is so life-like you'll be hitting the showers after you play. A newly designed intuitive control system allows instant playability but offers advanced players a reason to come back. Smarter AI, improved graphics and smooth play put you on the floor with the Starting Five "
9500,The Suffering: Ties That Bind,the-suffering-ties-that-bind,Action,M,PS2,Midway Games,Surreal Software,,,,0.0,0.17,0.09,0.07,,0.02,2005.0,,http://www.vgchartz.com/game/5855/the-suffering-ties-that-bind/?region=All,1,,/games/boxart/8163595ccc.gif,0.17,"The City Has It's Demons... But So Do You.
An inescapable enemy taunts and beckons torque, even as he fights to rid the horror from the streets. The dark heart of the city can seem very much like a prison, if you let it.

Customize your insanity: Use Good or Evil Rage Mode to destroy your enemies.
Lead Torque on an all-new battle through the mean streets of an urban nightmare.
Dozens of new monsters and a few old favorites await your wrath.
Use anything from lead pipes to rocket launchers to exact your revenge.

--Box "
9501,EyeToy: Kinetic,eyetoy-kinetic,Sports,E,PS2,Sony Computer Entertainment,SCEE London Studio,,,,0.0,0.17,0.09,0.07,,0.02,2005.0,,http://www.vgchartz.com/game/693/eyetoy-kinetic/?region=All,1,,/games/boxart/full_4413566AmericaFrontccc.jpg,0.17,"EyeToy: Kinetic™ is an innovative fitness product that provides players with an authentic personalized exercise program all in the comfort of their own home Utilizing the revolutionary EyeToy® USB Camera technology and developed in association with Nike Motionworks (experts in fitness, motion and body movement) players will experience a more effective workout inspired by activities such as Tai Chi, Kick Boxing, Aerobics, Yoga, Modern Dance and more. Two unique personal trainers provide direction, real-time performance evaluations and encouragement as players of all fitness levels engage in a comprehensive 12-week training routine or select individual routines to shape and tone specific areas. Wrapped in modern styling and supplemented with an energetic soundtrack, EyeToy: Kinetic is a fun and immersive fitness product like no other.Source - www.SONY.com "
9502,Project Spark,project-spark,Misc,E10,XOne,Microsoft Studios,Team Dakota,,,,0.0,0.17,0.11,0.05,,0.02,2014.0,09th Aug 18,http://www.vgchartz.com/game/73063/project-spark/?region=All,1,,/games/boxart/full_2358176AmericaFrontccc.jpg,0.17, 
9503,Army Men: Sarge's Heroes 2,army-men-sarges-heroes-2,Shooter,T,PS2,3DO,3DO,,,,0.0,0.17,0.09,0.07,,0.02,2001.0,,http://www.vgchartz.com/game/26935/army-men-sarges-heroes-2/?region=All,1,,/games/boxart/full_307650AmericaFrontccc.jpg,0.17,"If the Green and Tan armies ever stop fighting, it could be the end to one of the largest franchises ever created. The Army Men hit the PS2 in force, storming the little black brick with Sarge's Heroes 2, one of three Army Men games stepping up to the next-generation PlayStation. While not incredibly different from the PlayStation version of the same name (it even shares the same CG movies that unfold the story), there are some noticeable upgrades. Most obvious is the graphics. High-res textures, more animation, and better lighting keep things looking interesting, while the PS2's enhanced support for surround sound means an aural boost for better immersion.
us.playstation.com "
